,prev_line,current_line,tone
0,今の会社ではシステムをKL5からGR6に変えました,大変だったろう でもやりました,neutral
1,大変だったろう でもやりました,シューティーでは、職務の話ならしい,neutral
2,シューティーでは、職務の話ならしい,うんちデューティー? どうぞ,surprise
3,うんちデューティー? どうぞ,君は部長職だ デューティーは重いぞ,neutral
4,君は部長職だ デューティーは重いぞ,なるほど だがデューティーは部下に振り分けろ」,neutral
5,なるほど だがデューティーは部下に振り分けろ」,よかった,neutral
6,よかった,その詳細だが,neutral
7,その詳細だが,今はよしましょう,fear
8,今はよしましょう,採用については月曜に電話する だが君なら我が社でやっていける,neutral
9,採用については月曜に電話する だが君なら我が社でやっていける,もうリラックスして 感謝します ジョークを我慢してつらかった,neutral
10,先月デートしたウェートレス?,やっぱよす,sadness
11,やっぱよす,誰のことだよ,surprise
12,誰のことだよ,誰のことか私も分かんない,fear
13,誰のことか私も分かんない,それじゃ一,neutral
14,それじゃ一,今夜泊まる部屋があるか聞いてくる,neutral
15,モニカ,嫌なニュースよ,neutral
16,嫌なニュースよ,聞きたいね,joy
17,聞きたいね,喫茶店になるんだって,neutral
18,喫茶店になるんだって,酒はなし? たむろできないよ,disgust
19,酒はなし? たむろできないよ,ビールを 同居人は?,neutral
20,ビールを 同居人は?,決めた,joy
21,決めた,あのイタリア系?,neutral
22,あのイタリア系?,まあね,joy
23,モニカがかわいそう,回T?,surprise
24,回T?,この詩はモニカのことよ,neutral
25,この詩はモニカのことよ,僕の花瓶は中が空っぽ僕が触れても満たされない,neutral
26,僕の花瓶は中が空っぽ僕が触れても満たされない,空っぽの女だと思ってる,surprise
27,空っぽの女だと思ってる,絶対よモニカは幸せそうなのに,sadness
28,新聞配達に寄った,感触は?,neutral
29,感触は?,気難しい面接官だけどマークの助言どおり一 秋物の話で盛り上がったわ,joy
30,気難しい面接官だけどマークの助言どおり一 秋物の話で盛り上がったわ,さすが君だ,joy
31,さすが君だ,聞いて ごめんよ嫉妬でバカを言ったしっと 君を想うばかりに,sadness
32,聞いて ごめんよ嫉妬でバカを言ったしっと 君を想うばかりに,分かってる,neutral
33,ジョーイよくやった,気に入った?,surprise
34,気に入った?,もちろん,joy
35,もちろん,どのシーンが? 全部だよ帰ろう,neutral
36,どのシーンが? 全部だよ帰ろう,もっと具体的に言って,anger
37,もっと具体的に言って,具体的な部分がよかった,joy
38,具体的な部分がよかった,カンガルーのシーンは? よかった?,neutral
39,カンガルーのシーンは? よかった?,お前は寝てた!,anger
40,お前は寝てた!,俺のカンガルー案は却下されたよ,anger
41,俺のカンガルー案は却下されたよ,今夜はどうもじゃあな,neutral
42,今夜はどうもじゃあな,こいつも寝てるぞ!,surprise
43,ケーキは失敗だとバラそう,今日はみんな変だよ 感謝祭じゃなく告白祭か?,anger
44,私の最期のお願いよ,あの指輪と埋葬されないと私の魂は永遠に地獄を,neutral
45,あの指輪と埋葬されないと私の魂は永遠に地獄を,もう十分,neutral
46,もう十分,そう言われても,neutral
47,そう言われても,よく見せて,joy
48,よく見せて,換えるよ ありがとう,neutral
49,あれからどうしてた?,変わりないわ エアロビ教えたりパーティーで騒いだり,neutral
50,変わりないわ エアロビ教えたりパーティーで騒いだり,ボンド映画のポスターに出てる脚は私のよ,neutral
51,ボンド映画のポスターに出てる脚は私のよ,キャッチが入った,joy
52,キャッチが入った,ホレた 知ってる,neutral
53,ホレた 知ってる,お待たせ,neutral
54,お待たせ,どこかで会わない?,neutral
55,どこかで会わない?,いいとも 明日5時にビレッジのセントラルパークは?,neutral
56,いいとも 明日5時にビレッジのセントラルパークは?,いいわ明日ね,neutral
57,いいわ明日ね,電話加入の元が取れた,joy
58,電話加入の元が取れた,電話じゃボブになれてもご対面したら ニセ者とバレるよ,neutral
59,電話じゃボブになれてもご対面したら ニセ者とバレるよ,ボブに会えず彼女はショックで! 隣の席の男に慰めを求める,neutral
60,ボブに会えず彼女はショックで! 隣の席の男に慰めを求める,君は悪魔だ,disgust
61,バケツを敬えってのよ,入れたと思う?,anger
62,でも僕の式だ,遅れるわ レッツゴー,anger
63,遅れるわ レッツゴー,式のビデオ見せるよ,neutral
64,式のビデオ見せるよ,本だよフィービーちゃん,joy
65,本だよフィービーちゃん,行こうじゃあね,joy
66,行こうじゃあね,ロンドンだぜ,joy
67,明日はオーディション巡りだ 保険はすぐ戻るよ,よかったな トイレに行けば?,disgust
68,よかったな トイレに行けば?,どうした?,disgust
69,どうした?,何でもないダンベルで体操したら腹に痛みが それで気絶して一 その後動けないだけ,fear
70,何でもないダンベルで体操したら腹に痛みが それで気絶して一 その後動けないだけ,大したことない,neutral
71,大したことない,ヘルニアだな医者へ,surprise
72,ヘルニアだな医者へ,行くもんかこの何かが腹から出てくるまではな,fear
73,行くもんかこの何かが腹から出てくるまではな,脱腸だって,disgust
74,脱腸だって,運動して失敗した ダンベルのバカ!,anger
75,ステキな部屋ね これはどこの?,18世紀のインドの装飾品だ,neutral
76,18世紀のインドの装飾品だ,あなたって恐竜以外も詳しいのね,surprise
77,あなたって恐竜以外も詳しいのね,いろいろとね,neutral
78,まとめよう 僕らは楽しんでる君は若く見える,でも物足りない だからこれだ,neutral
79,でも物足りない だからこれだ,早すぎない?,neutral
80,妻のナンシーだ 冗談やめて,ロス話があるの,neutral
81,ロス話があるの,ありがたい 話って何?,neutral
82,ありがたい 話って何?,実は ジョーイと別れたの,sadness
83,実は ジョーイと別れたの,ホント?どうして? ジョーイはいい人よ,surprise
84,ホント?どうして? ジョーイはいい人よ,でもやっぱり一 違いすぎるホモエレクトスで笑うのよ,sadness
85,でもやっぱり一 違いすぎるホモエレクトスで笑うのよ,やっぱやつか,anger
86,やっぱやつか,だからこれでよかったの,sadness
87,だからこれでよかったの,大丈夫?,neutral
88,大丈夫?,ホント言うと一 ほかにも別れた理由があるの,neutral
89,ホント言うと一 ほかにも別れた理由があるの,気づいたのよ ほかの人を好きになりかけてるって,neutral
90,気づいたのよ ほかの人を好きになりかけてるって,基調講演者はプールに投げられるのが恒例だ,neutral
91,基調講演者はプールに投げられるのが恒例だ,クラリック教授 大事な話の最中です,neutral
92,クラリック教授 大事な話の最中です,今はちょっと,neutral
93,今はちょっと,2人とも投げようか,joy
94,2人とも投げようか,僕らは知的な科学者だしそれに何より一,neutral
95,僕らは知的な科学者だしそれに何より一,捕まらないよ逃げろ!,joy
96,便利な帽子でしょ,この砂は?,surprise
97,この砂は?,嵐でこうなったのね,neutral
98,嵐でこうなったのね,巨大なネコのトイレかも,neutral
99,あの顔覚えて あとで俺が殴る,俺のシーンはこのあとだ,joy
100,俺のシーンはこのあとだ,生麦生米と言っても納得しそう,neutral
101,生麦生米と言っても納得しそう,何してるの?,neutral
102,何してるの?,オムツのCMが?,neutral
103,オムツのCMが?,子供とか責任ってもう,fear
104,子供とか責任ってもう,ピザです 僕が出る!,joy
105,食事よりキャッチボールの記録に挑む?,挑むとも,neutral
106,挑むとも,2時間落とさなかったらすごいよな?,joy
107,2時間落とさなかったらすごいよな?,確かに,neutral
108,確かに,小便したいレイチェルが入ってる,sadness
109,小便したいレイチェルが入ってる,ダメかと思った,surprise
110,ダメかと思った,本当にね投げる手は替えるな,fear
111,エリンとは? 最高に楽しいデートだった,君らは正しかった,joy
112,君らは正しかった,最初のデートは緊張でぎこちなかったんだ,neutral
113,最初のデートは緊張でぎこちなかったんだ,エッチは? したせいで落ち着いた,neutral
114,エッチは? したせいで落ち着いた,彼女とは趣味が合うサンドイッチ好きだしね でもひいきの球団が違う点は子供ができたとき困るな,joy
115,彼女とは趣味が合うサンドイッチ好きだしね でもひいきの球団が違う点は子供ができたとき困るな,どうしようジョーイが子供だって あのジョーイがよ 私より先に結婚しないで,surprise
116,眠ってるの?,公共の場でだ,neutral
117,公共の場でだ,何しやがる! どうも,surprise
118,何しやがる! どうも,居眠りしてたよ,neutral
119,居眠りしてたよ,どうしたの?,surprise
120,どうしたの?,ゆうべ一睡も,anger
121,ゆうべ一睡も,おばあちゃんの彼が来て ベッドの上で死にかけてたみたいで,disgust
122,おばあちゃんの彼が来て ベッドの上で死にかけてたみたいで,死ぬとかいいか?って,neutral
123,死ぬとかいいか?って,ずっと叫びっぱなし,disgust
124,ずっと叫びっぱなし,今夜うちに泊まって,neutral
125,何かが破裂してる,破水よ落ち着いて,neutral
126,破水よ落ち着いて,破水? それって何なの?,surprise
127,正気なの? 絶対ジョーイに殺されるわ,分かってるよ,anger
128,分かってるよ,なぜ不明なの?,surprise
129,なぜ不明なの?,ひどいわ,joy
130,ひどいわ,ジーナじゃ?,neutral
131,ジーナじゃ?,ジーナ?,neutral
132,ジーナ?,飛行機のイアリングを,neutral
133,飛行機のイアリングを,あれはディーナよ,neutral
134,あれはディーナよ,ほら識別できない 寝た相手でしょ ベロニカだ 赤いスカートのコに舌を入れた,surprise
135,土曜により笑える,ファッションの講義に誘えるのは彼だけよ,neutral
136,ファッションの講義に誘えるのは彼だけよ,あなたは嫌でしょ,neutral
137,あなたは嫌でしょ,ホント?,surprise
138,ホント?,僕だって毎日服は着る,neutral
139,僕だって毎日服は着る,その気ならなれるさ ファッションの一,neutral
140,その気ならなれるさ ファッションの一,じゃぜひ一緒に行って,joy
141,じゃぜひ一緒に行って,何か? 何着てけば?,fear
142,やった! 今のはすごかった,最高だよ 完ぺきに決まった,joy
143,最高だよ 完ぺきに決まった,あんたのおかげだ もう時間だ バスに乗っていくよ,joy
144,あんたのおかげだ もう時間だ バスに乗っていくよ,頑張れ,neutral
145,頑張れ,もう一度フォックストロットかタンゴは?,neutral
146,もう一度フォックストロットかタンゴは?,ありがたいが一 次は女と踊る,neutral
147,ありがたいが一 次は女と踊る,ぶちかませ,neutral
148,ぶちかませ,来るか? マージの友達と踊れよ!,neutral
149,来るか? マージの友達と踊れよ!,彼女は俺と同サイズだ,neutral
150,彼女は俺と同サイズだ,いや結構,neutral
151,緊張するよ 耐えるコツは?,めったに受けないし,neutral
152,めったに受けないし,居残りってことは合格?,surprise
153,居残りってことは合格?,俺も初体験,neutral
154,俺も初体験,2次合格はレイモンドとベンカイルにジョーイよ ご苦労さま,neutral
155,2次合格はレイモンドとベンカイルにジョーイよ ご苦労さま,やっぱり合格だ! バイバイ 残念だね お疲れ,joy
156,やっぱり合格だ! バイバイ 残念だね お疲れ,その組み合わせはないわ似てないもの カイルとベンのコンビで決まり,neutral
157,その組み合わせはないわ似てないもの カイルとベンのコンビで決まり,おかしなことになった ホントだね,neutral
158,おかしなことになった ホントだね,僕らは親友だから変なんだ,neutral
159,何せ3人もやっつけて鼻血まで出させた,頑張れたのは君のおかげだ,joy
160,頑張れたのは君のおかげだ,君はすばらしい人だ 頭でも打った?,fear
161,君はすばらしい人だ 頭でも打った?,本心だよありがと,joy
162,本心だよありがと,うれしいわ 痛かった? 痛みも忘れる,fear
163,うれしいわ 痛かった? 痛みも忘れる,やっぱ忘れない,sadness
164,マイクと間違えた件だけどその後は?,まあね 知りたいか?,joy
165,まあね 知りたいか?,言葉ゲームがしたいのね 興奮しちゃってバレバレよ,neutral
166,言葉ゲームがしたいのね 興奮しちゃってバレバレよ,デビッドが求婚する,joy
167,デビッドが求婚する,回T?,surprise
168,回T?,言ったでしょ,anger
169,言ったでしょ,あなたはアドバイスしちゃダメ,anger
170,あなたはアドバイスしちゃダメ,冗談でかわせなかったの?,anger
171,冗談でかわせなかったの?,巨根でかわした!,neutral
172,巨根でかわした!,きっと求婚を断って彼は傷つく 2人は別れてフィービーはまた一人ぼっちよ,anger
173,きっと求婚を断って彼は傷つく 2人は別れてフィービーはまた一人ぼっちよ,ひどいアドバイスだ,surprise
174,ひどいアドバイスだ,僕は 復活した ありがと失礼するよ,neutral
175,父のポールよ彼はロスゲラー,初めましてポールさん,joy
176,初めましてポールさん,ミスタースティーブンスと呼びたまえ,neutral
177,ミスタースティーブンスと呼びたまえ,はいミスタースティーブンス,neutral
178,はいミスタースティーブンス,ロス 君は変態か?,anger
179,ロス 君は変態か?,回9Ce?,surprise
180,回9Ce?,同年代の女と付き合え,anger
181,同年代の女と付き合え,面白い いや面白くない,fear
182,面白い いや面白くない,娘との交際には反対だ,neutral
183,娘との交際には反対だ,なるほど,neutral
184,なるほど,僕に一度チャンスをください お気持ちを変えてみせます,fear
185,僕に一度チャンスをください お気持ちを変えてみせます,分かった,neutral
186,分かった,一度だけチャンスをやる 時間は1分,anger
187,一度だけチャンスをやる 時間は1分,パパ 分かった,surprise
188,番組表に出てるか? まだ放送前だ,ならまだ飾らん,neutral
189,ならまだ飾らん,じゃ証拠ビデオを持ってくる,neutral
190,じゃ証拠ビデオを持ってくる,マットラウアーの洗濯前の服があったら貸して,neutral
191,確か? ええバッチリ でもそれより問題は,下が?,surprise
192,下が?,大きなテント状態,neutral
193,大きなテント状態,2 ...-),neutral
194,2 ...-),女優だ,surprise
195,女優だ,彼女に言おう友達としての務めだ,anger
196,彼女に言おう友達としての務めだ,女性の人権問題だだろ?,anger
197,女性の人権問題だだろ?,言うべきだ,neutral
198,言うべきだ,俺は女の味方さ,neutral
199,俺は女の味方さ,憎まれ役だわ,fear
200,憎まれ役だわ,それが?,neutral
201,結婚して 結婚しない?,励ましにきた,joy
202,励ましにきた,指輪は?,neutral
203,指輪は?,ポケットだ,neutral
204,ポケットだ,フィービー,surprise
205,フィービー,モニカにバレるから出てってよ,neutral
206,モニカにバレるから出てってよ,出てけよ,neutral
207,出てけよ,どうも,neutral
208,どうも,きれいだ ありがと,joy
209,きれいだ ありがと,何ごと?,joy
210,何ごと?,私たち感激 慈善イベントに行くことが,neutral
211,ロス,少し暑いからセーターを脱ぐわ,neutral
212,少し暑いからセーターを脱ぐわ,でも 愛の肉体行動を誘ってるわけじゃない,neutral
213,でも 愛の肉体行動を誘ってるわけじゃない,もうよすわ,neutral
214,もうよすわ,でも昨夜は君も泡食ってた,neutral
215,でも昨夜は君も泡食ってた,あれぐらい平気よ何とも思ってない,neutral
216,あれぐらい平気よ何とも思ってない,バツが悪かったろ,surprise
217,バツが悪かったろ,私はあなたと違って簡単に動じないもの,neutral
218,私はあなたと違って簡単に動じないもの,ホント?,neutral
219,ホント?,いくら君がせがんでもお断りだ,disgust
220,ウソみたい乗れたわー,一生無理だと思ってた,joy
221,一生無理だと思ってた,ありがと,joy
222,ありがと,自分に感謝しなよ 恐怖を克服したのは君なんだから一,joy
223,2人とも必要だ,君らは僕の 僕は幸せ者だ,neutral
224,君らは僕の 僕は幸せ者だ,ありがと,neutral
225,ありがと,あれ何だ?,neutral
226,あれ何だ?,ガキだな 泣き虫め,sadness
227,いろいろ試作品を作ったから試着して,いい感じ,joy
228,いい感じ,これはキノコの傘」 こっちはソーセージ,joy
229,これはキノコの傘」 こっちはソーセージ,ツマヨウジは? 仮止め用よ,disgust
230,女とキスしたの?,おあいこ?,neutral
231,おあいこ?,花を水に入れてくる,neutral
232,花を水に入れてくる,式場から盗んだの?,surprise
233,式場から盗んだの?,ロビーからだよ,neutral
234,ロビーからだよ,アダルトビデオとナッツを請求された仕返しだ,anger
235,アダルトビデオとナッツを請求された仕返しだ,僕のセーターだ,surprise
236,僕のセーターだ,1か月も捜したよ,surprise
237,幸せ? この私が幸せだと言うの?,じゃ君はどうしたい,anger
238,じゃ君はどうしたい,僕には謎だよ,anger
239,僕には謎だよ,話しかけても君の瞳は死んでる,anger
240,話しかけても君の瞳は死んでる,質問が,neutral
241,質問が,エイドリアンはなぜこんな男といるの?,disgust
242,エイドリアンはなぜこんな男といるの?,深く掘り下げろ まずハンサムだ,neutral
243,深く掘り下げろ まずハンサムだ,見た目以外に理由は?,neutral
244,見た目以外に理由は?,こう考えたら?,neutral
245,こう考えたら?,脚本にあるから,anger
246,脚本にあるから,君の役こそ魅力がないクソ女と書いてある,anger
247,君の役こそ魅力がないクソ女と書いてある,書いてない,anger
248,書いてない,俺のに書いた,anger
249,撮る前に断らなきゃ,彼らもいいカメラを グレッグジェニー?,neutral
250,彼らもいいカメラを グレッグジェニー?,電話しない? しよう,neutral
251,電話しない? しよう,土産買ったか聞け,joy
252,土産買ったか聞け,8丁目のデリ?,neutral
253,8丁目のデリ?,食中毒のうわさがある店だ,disgust
254,食中毒のうわさがある店だ,間違えたわ,fear
255,間違えたわ,また同じ店,surprise
256,また同じ店,じゃ俺が注文する,joy
257,じゃ俺が注文する,番号が違う,sadness
258,俺も愛してるでも今夜は遅いから 貸して 母さん病院に予約入れて,これ母さんじゃない,surprise
259,これ母さんじゃない,ロニーって女だ ペットの葬儀屋だ,neutral
260,ロニーって女だ ペットの葬儀屋だ,あっそ いつから?,neutral
261,あっそ いつから?,ガキのころ一緒に船を見にいったろ,neutral
262,ガキのころ一緒に船を見にいったろ,当時から?,surprise
263,当時から?,いや6年前だ,neutral
264,いや6年前だ,いい親父だったことアピールしてみた,neutral
265,いい親父だったことアピールしてみた,女にホレたことは?,neutral
266,女にホレたことは?,さあね,neutral
267,さあね,じゃまだかこげてるぞ 親父の胸が?,neutral
268,じゃまだかこげてるぞ 親父の胸が?,俺は本気なんだ 同時に2人を愛してる,neutral
269,俺は本気なんだ 同時に2人を愛してる,1人は母さんだって言ってよ,disgust
270,1人は母さんだって言ってよ,もちろんだ決まってる,surprise
271,もう大丈夫だ いいね クワちゃん,サージ先生だ 彼はアヒルだね? でなきや専門外だ,surprise
272,今日はイスから落ちた,あなたの物だって,neutral
273,あなたの物だって,ロスの仕返しね,neutral
274,ロスの仕返しね,どうせシャンプーとか,neutral
275,どうせシャンプーとか,どうした?,neutral
276,どうした?,幸せ? 私が幸せだと?,neutral
277,最後は中生代を21世紀に再現しよう,それで終わり?,surprise
278,言いすぎてごめん,確かにアホな名だよ,disgust
279,確かにアホな名だよ,悪くない 最低だ,neutral
280,悪くない 最低だ,今後は名なしでいく,anger
281,今後は名なしでいく,じゃただのビング?,neutral
282,部屋が戻った,エースは最強だ JAKAの順,surprise
283,エースは最強だ JAKAの順,分からない ほら手品,surprise
284,分からない ほら手品,やり直しよ,neutral
285,やり直しよ,部屋よ来い クイーンよ,anger
286,部屋よ来い クイーンよ,まだまだ キングだ,surprise
287,まだまだ キングだ,もう一度よ,joy
288,もう一度よ,回T?,neutral
289,回T?,チケットを コートサイドだ,joy
290,チケットを コートサイドだ,いい戦いだった 部屋が戻ったのに怒る?,surprise
291,いい戦いだった 部屋が戻ったのに怒る?,分かってない,joy
292,たかが散歩にこんなに赤ん坊グッズが必要?,効果はあるよ,neutral
293,効果はあるよ,女は赤ん坊に弱いんだ,neutral
294,女は赤ん坊に弱いんだ,赤ん坊を抱く男にも弱い,neutral
295,赤ん坊を抱く男にも弱い,女の方にベンを構えろ,neutral
296,女の方にベンを構えろ,待て、目標変更だ,joy
297,待て、目標変更だ,ベンを貸せ,neutral
298,ベンを貸せ,俺に任せろ,neutral
299,俺に任せろ,ヤりたいの?,surprise
300,ヤりたいの?,一口,neutral
301,一口,やっぱかわいい? 俺って,surprise
302,やっぱかわいい? 俺って,においかぐ?,neutral
303,においかぐ?,もちろん赤ん坊の方だ味わってよ,joy
304,もちろん赤ん坊の方だ味わってよ,ほらね,joy
305,ほらね,当然だよ,neutral
306,就業規則に反するってわけじゃないけど一 バレたら渋い顔されるよ,嫌みユーゾウ先生にね,anger
307,嫌みユーゾウ先生にね,今に兄さんも手出しハヤオと呼ばれるわ,joy
308,今に兄さんも手出しハヤオと呼ばれるわ,どうしたら?,neutral
309,どうしたら?,大切なのは人の目より自分の気持ちだ,neutral
310,大切なのは人の目より自分の気持ちだ,正直にいけ,neutral
311,正直にいけ,いい言葉ね,joy
312,いい言葉ね,俺のオーディションだけど木曜で決まりかな?,neutral
313,俺のオーディションだけど木曜で決まりかな?,まだだ,sadness
314,まだだ,まだ?,surprise
315,まだ?,今夜の食事で話す,neutral
316,今夜の食事で話す,またデート?,neutral
317,またデート?,誰と? 同級生のデーナキーストン,neutral
318,誰と? 同級生のデーナキーストン,覚えてるあのコね,surprise
319,覚えてるあのコね,それはデーナキャプラン,neutral
320,それはデーナキャプラン,知らないくせに いいじゃん,surprise
321,天才発明家とロボットは元気?,触るな,anger
322,触るな,俺がクビだってウワサが飛び交ってるし一,neutral
323,俺がクビだってウワサが飛び交ってるし一,ほかの役者を審査してる,fear
324,ほかの役者を審査してる,チャンスをくれよ,sadness
325,チャンスをくれよ,だから触るなってことねどうぞ,surprise
326,だから触るなってことねどうぞ,ダメだ,anger
327,ダメだ,立ち直れない,anger
328,立ち直れない,元気かい?,neutral
329,さっきの件だけど,いいんだ君はストレスがたまってる,neutral
330,いいんだ君はストレスがたまってる,謝る気はないわけ?,disgust
331,謝る気はないわけ?,追い出されたのは僕だよ,anger
332,追い出されたのは僕だよ,押しかけてくる権利はない,anger
333,押しかけてくる権利はない,記念日に待ちぼうけなんてかわいそうな僕,anger
