,prev_line,current_line,tone
3908,それはすごいね 今度はデザイナーとの人間関係を築く仕事だ,度を超えて親しくなる点が玉にキズよ,neutral
3909,度を超えて親しくなる点が玉にキズよ,デザイナーとぜひ,joy
3910,デザイナーとぜひ,裸のお付き合いね,neutral
3911,部下はいる?,部下から電話が? 俺は病気だって言った?,fear
3912,自信を持ってあなたの笑顔はステキよ,ホント?,surprise
3913,ホント?,笑顔はやめて別の表情を,neutral
3914,笑顔はやめて別の表情を,セクシーな顔は?,neutral
3915,セクシーな顔は?,ボツよ,neutral
3916,チャンドラーは?,ここだ 手を洗って!,neutral
3917,ここだ 手を洗って!,何で分かったの?,surprise
3918,何で分かったの?,連れて帰ったわけ?,surprise
3919,連れて帰ったわけ?,アイスじゃないわよ,neutral
3920,アイスじゃないわよ,それより地図を作ってみたんだ,neutral
3921,事件って何? バーに行ったら,聞こえなかった? おおい!って,anger
3922,聞こえなかった? おおい!って,女がチャンドラーに視線を,neutral
3923,女がチャンドラーに視線を,こいつはその女の所へ行って2分後にはキスしてた,neutral
3924,こいつはその女の所へ行って2分後にはキスしてた,男とキスを?,joy
3925,男とキスを?,店が暗かったしきれいな男だった,anger
3926,店が暗かったしきれいな男だった,腹がよじれた,joy
3927,腹がよじれた,またパンツを汚しちゃった?,anger
3928,またパンツを汚しちゃった?,でも君は男とキスした,neutral
3929,私が希望するだけ同居して,いいわよ,neutral
3930,いいわよ,私はバカじゃない出産の本は読破したけど一 出産後の部分は読んでないの,neutral
3931,私はバカじゃない出産の本は読破したけど一 出産後の部分は読んでないの,もうすぐ出産なのに何も分からない,neutral
3932,もうすぐ出産なのに何も分からない,オムツポットに吐いていい?」,sadness
3933,オムツポットに吐いていい?」,何も心配することないわ,neutral
3934,何も心配することないわ,どこ行くの?,fear
3935,どこ行くの?,お手洗いよ,neutral
3936,お手洗いよ,大丈夫よ私がついてる,neutral
3937,大丈夫よ私がついてる,大丈夫ですわ,neutral
3938,大丈夫ですわ,何で汗かいてるの?,surprise
3939,何で汗かいてるの?,チャンドラーをハメハメした,neutral
3940,チャンドラーをハメハメした,いなかったくせに,neutral
3941,今日は話があるの 結婚式での付き添い役の件よ,ついに来た,joy
3942,ついに来た,あなたが適任よ,neutral
3943,あなたが適任よ,あなたよ そうね,joy
3944,あなたよ そうね,断っとくけど2人とも愛する親友よ,joy
3945,断っとくけど2人とも愛する親友よ,分かった誰?,joy
3946,分かった誰?,それぞれが順に付き添い役をやらない?,neutral
3947,それぞれが順に付き添い役をやらない?,私のがフィービーなら,neutral
3948,私のがフィービーなら,例え話よ,anger
3949,例え話よ,でもうれしい,neutral
3950,でもうれしい,レイチェルはフィービーので私がレイチェルの付き添い役を,neutral
3951,レイチェルはフィービーので私がレイチェルの付き添い役を,いいアイデアね モニカのは誰?,neutral
3952,いいアイデアね モニカのは誰?,ここがいいとこよ2人で決めて,neutral
3953,ここがいいとこよ2人で決めて,何でいいとこ?,surprise
3954,何でいいとこ?,私に責任がないから,joy
3955,私に責任がないから,喜んで決めるわ モニカのためだもん,neutral
3956,喜んで決めるわ モニカのためだもん,私は決めないわ,anger
3957,私は決めないわ,あなたもね いい人だわ,joy
3958,ドラムの騒音だけじゃないスティックを投げては一,目に当たった! わめくの,anger
3959,目に当たった! わめくの,うるさすぎる,anger
3960,うるさすぎる,ありがと普通はそういう反応よね,neutral
3961,ありがと普通はそういう反応よね,ドラムを贈ったのはレイチェルを追い出すため?,surprise
3962,ドラムを贈ったのはレイチェルを追い出すため?,掘り下げればね,neutral
3963,2円NEE 部屋にいるかと,デートの迎えだ,neutral
3964,デートの迎えだ,それとブラウニー,joy
3965,それとブラウニー,半分だけ,neutral
3966,半分だけ,ホントは袋だけ,neutral
3967,ホントは袋だけ,花屋から歩いたら腹減って,neutral
3968,花屋から歩いたら腹減って,本物のデートみたい,joy
3969,本物のデートみたい,つわりで吐きそうだしパンツのゴムの位置は一,neutral
3970,つわりで吐きそうだしパンツのゴムの位置は一,本物のデートだよ,neutral
3971,本物のデートだよ,いい部屋だね,neutral
3972,いい部屋だね,フーズボールにピザの箱一,surprise
3973,フーズボールにピザの箱一,プレイボーイもある,surprise
3974,プレイボーイもある,同居人の物よ,neutral
3975,同居人の物よ,会いたいね 実に堂々とした男だ,neutral
3976,会いたいね 実に堂々とした男だ,彼は私の保護者よ気をつけて,neutral
3977,彼は私の保護者よ気をつけて,その同居人はいい男?,joy
3978,その同居人はいい男?,誘惑に駆られない?,neutral
3979,誘惑に駆られない?,でもゲイよ,neutral
3980,でもゲイよ,やめてよ せっかく盛り上がってきたのに,anger
3981,昔から負けず嫌いよ,目クソさん?鼻クソが笑ってる,neutral
3982,目クソさん?鼻クソが笑ってる,やめて 兄貴の方が重症よ,disgust
3983,やめて 兄貴の方が重症よ,お絵かきゲームで「暴れたのは?」,neutral
3984,お絵かきゲームで「暴れたのは?」,あれはジェスチャーよ,neutral
3985,あれはジェスチャーよ,面接に来いって どこから?,joy
3986,ラケットボールが,サイズを言わない,surprise
3987,サイズを言わない,ゴーグル忘れて,surprise
3988,ゴーグル忘れて,大変みたいね,neutral
3989,大変みたいね,じゃあね,neutral
3990,じゃあね,当てつけか?,neutral
3991,当てつけか?,隠す気か? やつに言えるか?,neutral
3992,隠す気か? やつに言えるか?,母親がバラすかも,neutral
3993,母親がバラすかも,ここで何を?,anger
3994,ここで何を?,また股当て忘れた,surprise
3995,また股当て忘れた,私の質問は何?,neutral
3996,汚された気分,我慢できずに自分の肌をかきむしったわ,disgust
3997,我慢できずに自分の肌をかきむしったわ,ロス10時だ,neutral
3998,ロス10時だ,疲労度で計ると2時だ,sadness
3999,疲労度で計ると2時だ,10時方向,neutral
4000,10時方向,時計でいう8時9時0時の方向に美女が!,joy
4001,時計でいう8時9時0時の方向に美女が!,ホントだ,joy
4002,ホントだ,彼女と比べるとほかの女がツラ親父に見える,joy
4003,彼女と比べるとほかの女がツラ親父に見える,早くナンパしたら,joy
4004,早くナンパしたら,何て声かける? 失礼ンガンガ,fear
4005,何て声かける? 失礼ンガンガ,ビビることないわ,joy
4006,ビビることないわ,落とせないとでも?ロス言ってやれ,neutral
4007,落とせないとでも?ロス言ってやれ,絶対に落とせないね ありがと,neutral
4008,絶対に落とせないね ありがと,でも美人ってくだらない男とくっつくわ 可能性大よ,neutral
4009,景色のほかもすごいぞ,座って,neutral
4010,座って,見ててよ ヘレン来てくれ,joy
4011,見ててよ ヘレン来てくれ,もういいよ,neutral
4012,もういいよ,これが最後だ,neutral
4013,本当に本当にごめんなさい,君の好きな料理を作るしお望みのこともしちゃう,fear
4014,君の好きな料理を作るしお望みのこともしちゃう,料理は当然あっちは無理,anger
4015,料理は当然あっちは無理,でもバレンタインだしご機嫌直してよ」,sadness
4016,でもバレンタインだしご機嫌直してよ」,分かった,neutral
4017,分かった,俺も寝室へ?,neutral
4018,俺も寝室へ?,お断り!,joy
4019,確かに規則書にあるよ,オフィスにコンロを置くのも禁止だ,neutral
4020,オフィスにコンロを置くのも禁止だ,もう会えないなんて,sadness
4021,もう会えないなんて,僕もだよ でもデートはできない 禁じられてるからね,neutral
4022,僕もだよ でもデートはできない 禁じられてるからね,どんなにホットでも人の道に外れることだ,joy
4023,どんなにホットでも人の道に外れることだ,やめて 交際は背徳だしみだらなことだよ,joy
4024,やめて 交際は背徳だしみだらなことだよ,それに一 タブーだ,joy
4025,それに一 タブーだ,ここがいい わ紙 タオル投げもできる,joy
4026,ここがいい わ紙 タオル投げもできる,ついでにコンロも置こっと,joy
4027,情報ありがと 結婚式はいつ?,予定なしよ 試着だけ 私もよ,neutral
4028,予定なしよ 試着だけ 私もよ,冗談よ 本当は7月25日,joy
4029,冗談よ 本当は7月25日,私は12月,joy
4030,私は12月,あなたは? 5月15日,neutral
4031,あなたは? 5月15日,間近ね 写真家は決めた?,neutral
4032,間近ね 写真家は決めた?,ジェフリーよ,neutral
4033,ジェフリーよ,ヌード結婚式の見本見た? あの裸?ワーオ,surprise
4034,ヌード結婚式の見本見た? あの裸?ワーオ,結婚を早まったと思った,joy
4035,結婚を早まったと思った,バンドは? スイングキングスよ,neutral
4036,バンドは? スイングキングスよ,うらやましいうちはヘビメタバンドのカーカス,sadness
4037,うらやましいうちはヘビメタバンドのカーカス,頭文字はC?K? ヘビメタなんてグレート,joy
4038,頭文字はC?K? ヘビメタなんてグレート,この店で買っちゃダメよ,neutral
4039,この店で買っちゃダメよ,クラインマンズで半額で買える,neutral
4040,クラインマンズで半額で買える,ここはふっかけてるの,disgust
4041,ここはふっかけてるの,これの色違いはある?,neutral
4042,史上最高のデートの例として,ダニエルとそれほど濃密な時間を過ごした,joy
4043,ダニエルとそれほど濃密な時間を過ごした,その後電話は?,neutral
4044,その後電話は?,男からするかよ,anger
4045,男からするかよ,飢えてるみたいじゃん,neutral
4046,飢えてるみたいじゃん,だろ,neutral
4047,だろ,じらしてやれ,neutral
4048,じらしてやれ,男ってあきれるほどバカよね,surprise
4049,男ってあきれるほどバカよね,それ男性ホルモン過剰よ,anger
4050,それ男性ホルモン過剰よ,それシスコじやほめ言葉だ,neutral
4051,それシスコじやほめ言葉だ,マシンだ 留守電か?,neutral
4052,マシンだ 留守電か?,扇風機が応答した,neutral
4053,扇風機が応答した,伝言残したら?,neutral
4054,伝言残したら?,留守電にしゃべるとつい変なこと口走る,disgust
4055,留守電にしゃべるとつい変なこと口走る,バリーたちよ 一斉に見ないで,surprise
4056,バリーたちよ 一斉に見ないで,どんな様子?,neutral
4057,どんな様子?,話してる,neutral
4058,話してる,レイチェルにへこまされてる?,neutral
4059,君の仕事は何?,ここ数年はCM関係の仕事を また仕事の呼び出しなの?,neutral
4060,ここ数年はCM関係の仕事を また仕事の呼び出しなの?,仕方ないわ,neutral
4061,仕方ないわ,終わったら戻ってくるごめんね なぜか理科なのよ,sadness
4062,終わったら戻ってくるごめんね なぜか理科なのよ,変よね 専門じゃないのに,neutral
4063,変よね 専門じゃないのに,嫌なら言って こっちに呼びたいんだ,neutral
4064,嫌なら言って こっちに呼びたいんだ,こっちへ,neutral
4065,こっちへ,みんな詰めてくれるよ,neutral
4066,みんな詰めてくれるよ,おいで 詰めるよね?,neutral
4067,おいで 詰めるよね?,はいずれて,joy
4068,はいずれて,紹介するねキャロルだ,neutral
4069,紹介するねキャロルだ,クリステンだよ どうも,neutral
4070,クリステンだよ どうも,キャロルは教員だ,neutral
4071,キャロルは教員だ,それが変なんだよ 専門とは違うんだから,joy
4072,いいから選べよ あれはどう?,庭用の家具だ,surprise
4073,庭用の家具だ,うちに来た人があれ? ここは外かって? じゃあの鳥柄は?,neutral
4074,うちに来た人があれ? ここは外かって? じゃあの鳥柄は?,鳥柄はおもてなしって感じじゃない,neutral
4075,鳥柄はおもてなしって感じじゃない,じゃ選べ,neutral
4076,じゃ選べ,テントウ虫のは?,neutral
4077,テントウ虫のは?,赤い虫ならおもてなしなのかよ,anger
4078,赤い虫ならおもてなしなのかよ,鳥が好きなら買え,anger
4079,鳥が好きなら買え,誰が買うか,sadness
4080,ディジョンです お試しを,お試しを,neutral
4081,お試しを,ディジョン アナベル ねえ仕事帰りにコーヒーでもどう?,neutral
4082,ディジョン アナベル ねえ仕事帰りにコーヒーでもどう?,約束があるの,neutral
4083,約束があるの,行こうか?,neutral
4084,行こうか?,またね,neutral
4085,またね,女はカウボーイに弱いね ディジョンを,sadness
4086,今のは失神もの,2人によく報告しなきゃ,neutral
4087,2人によく報告しなきゃ,失神时前,joy
4088,失神时前,ラブラブよね,joy
4089,ラブラブよね,最高だわ,neutral
4090,最高だわ,最高なのは君だ,neutral
4091,最高なのは君だ,私って最高,neutral
4092,私って最高,どうも 何してた?,neutral
4093,どうも 何してた?,この前の美女じゃない?,neutral
4094,別れるしかないだろ,バカ言うな電話して仲直りしろ,sadness
4095,バカ言うな電話して仲直りしろ,大ゲンカしたのにすぐ電話を?,sadness
4096,大ゲンカしたのにすぐ電話を?,食後すぐ泳ぐなとは話が違う,anger
4097,食後すぐ泳ぐなとは話が違う,水泳の話は迷信さ,neutral
4098,水泳の話は迷信さ,レニーおじさんに言って,neutral
4099,レニーおじさんに言って,どうして?,neutral
4100,どうして?,迷信を信じてる,neutral
4101,子宮の状態は良好よ,ぶ厚い感じがしたわ,joy
4102,ぶ厚い感じがしたわ,じゃ卵をぶち込んでくれ,neutral
4103,じゃ卵をぶち込んでくれ,受精卵の準備に時間が,neutral
4104,受精卵の準備に時間が,卵1個じゃないの?,surprise
4105,卵1個じゃないの?,5個よ,neutral
4106,5個よ,ネコみたいにボコボコ産めってわけ?,neutral
4107,ネコみたいにボコボコ産めってわけ?,卵が着床する確率は125しかないの,neutral
4108,卵が着床する確率は125しかないの,つまり75妊娠できないってわけ? なら,surprise
4109,つまり75妊娠できないってわけ? なら,200個ぐらいぶち込んだらどうだ,neutral
4110,200個ぐらいぶち込んだらどうだ,ガムボールマシンじゃないのよ,neutral
4111,ガムボールマシンじゃないのよ,根性入れて妊娠するまで頑張るわ,neutral
4112,根性入れて妊娠するまで頑張るわ,これが最初で最後の勝負だ,neutral
4113,これが最初で最後の勝負だ,1回に1万600ドルかかるの,neutral
4114,1回に1万600ドルかかるの,私たちの貯金は今回でなくなるわ,neutral
4115,私たちの貯金は今回でなくなるわ,子宮にプレッシャーがかかった,disgust
4116,子宮にプレッシャーがかかった,ないわ,neutral
4117,ないわ,医者って役立たずね,surprise
4118,医者って役立たずね,酒だよ 高校時代妊娠した,anger
4119,食い物ない?ジョノの店が閉まってた,ラリーと食事に行って営業停止に,disgust
4120,ラリーと食事に行って営業停止に,好きな店が全滅だよどこで食えと?」,anger
4121,好きな店が全滅だよどこで食えと?」,清潔な店,neutral
4122,清潔な店,まずそう,neutral
4123,まずそう,ダニーよ,neutral
4124,ダニーよ,私は競技会で留守よ,fear
4125,私は競技会で留守よ,待って これから出る,anger
4126,待って これから出る,夜のボート大会ってどんな大会?,surprise
4127,夜のボート大会ってどんな大会?,偽の大会,anger
4128,偽の大会,おタマを借りたい,neutral
4129,おタマを借りたい,じゃまたね,neutral
4130,じゃまたね,ラリーならこう言ったわじゃおタマね,neutral
4131,効率いいわね,行こう,joy
4132,行こう,古い物がない,sadness
4133,古い物がない,財布に12歳から入れてるゴムが,neutral
4134,財布に12歳から入れてるゴムが,イケるわ,joy
4135,イケるわ,使い物には,neutral
4136,使い物には,あとは借り物ね,joy
4137,あとは借り物ね,これ借りよう,neutral
4138,これ借りよう,盗む気?,sadness
4139,盗む気?,あとで返す隠せ,neutral
4140,すまない あれから何してた?,そうね 別に,joy
4141,そうね 別に,今は仕事を すごいね,joy
4142,今は仕事を すごいね,日焼けした?,surprise
4143,日焼けした?,実は10 アルバ島へ,neutral
4144,くさい,心配したわ,sadness
4145,心配したわ,モニカ,anger
4146,モニカ,水がうめえ!,joy
4147,水がうめえ!,そうみたいね 職場から電話で今日は欠勤かって,neutral
4148,そうみたいね 職場から電話で今日は欠勤かって,休みよモニカとサーカスに行くの,neutral
4149,休みよモニカとサーカスに行くの,それじゃクビあなたらしくない,anger
4150,それじゃクビあなたらしくない,これが私よ,joy
4151,これが私よ,私はクッションを叩いてるだけじゃないのよ,anger
4152,私はクッションを叩いてるだけじゃないのよ,モニカと一緒だと別の私になれるの,joy
4153,モニカと一緒だと別の私になれるの,だって一,joy
4154,だって一,在宅です お待ちを モナナによ カード会社から,neutral
4155,在宅です お待ちを モナナによ カード会社から,そんな どうも,joy
4156,そんな どうも,モニカが逮捕された,sadness
4157,絵の具の隆起を見て モネは主に外界の物を描いた彼の主題は光なんだ,意味分かってる?,neutral
4158,意味分かってる?,いや口から言葉を吐いただけ,neutral
4159,いや口から言葉を吐いただけ,メモにはと書いたが正しいスペルじゃない,neutral
4160,メモにはと書いたが正しいスペルじゃない,発音に即したまでだ 即した?,neutral
4161,発音に即したまでだ 即した?,つまり時間がないからよす-,neutral
4162,つまり時間がないからよす-,でも見直したよ メモをすぐ覚えたね,surprise
4163,でも見直したよ メモをすぐ覚えたね,どういう意味? さあね,surprise
4164,どういう意味? さあね,その患者は死んだからクマに食われるって意味かな,neutral
4165,その患者は死んだからクマに食われるって意味かな,ルネサンスへ移ろう,neutral
4166,ルネサンスへ移ろう,カラバッジョは明暗法を用い人物の苦悩に光を当てた 触ってデコボコだ,neutral
4167,カラバッジョは明暗法を用い人物の苦悩に光を当てた 触ってデコボコだ,ダメだよ 絵には絶対触っちゃダメ,anger
4168,ダメだよ 絵には絶対触っちゃダメ,いいじゃん,neutral
4169,なぜ来ないの?,読んだ,joy
4170,読んだ,やっと?,surprise
4171,やっと?,腰を据えて読んだ,neutral
4172,腰を据えて読んだ,だって大事な手紙だろ 僕らにとって,joy
4173,だって大事な手紙だろ 僕らにとって,だから一語ずつかみしめて2度読んだ,joy
4174,だから一語ずつかみしめて2度読んだ,それで?,neutral
4175,それで?,いいの?,fear
4176,いいの?,該当する部分だけざっと再読させて,neutral
4177,該当する部分だけざっと再読させて,2度読んだと言ったわ,anger
4178,2度読んだと言ったわ,待ってよ迷ったりするもんか,neutral
4179,また結婚したと?,はい,neutral
4180,はい,この2年で2度目だ,neutral
4181,この2年で2度目だ,2年で2度で通算では3度です,neutral
4182,2年で2度で通算では3度です,弁護士として離婚を扱い23年だが君は最多記録だ,neutral
4183,弁護士として離婚を扱い23年だが君は最多記録だ,てんまつでは顛末を,neutral
4184,てんまつでは顛末を,レイチェルとベガスで酔って,neutral
4185,レイチェルとベガスで酔って,2度目の結婚で名前を呼んだのと同じレイチェル?,surprise
4186,2度目の結婚で名前を呼んだのと同じレイチェル?,でも愛してない,neutral
4187,でも愛してない,それはよかった,neutral
4188,それはよかった,酔った勢いだったので無効にしたい,neutral
4189,酔った勢いだったので無効にしたい,なるほど セラピーを受ける気は?,neutral
4190,なるほど セラピーを受ける気は?,無効の手続きに来ただけです」,neutral
4191,無効の手続きに来ただけです」,じゃ書類作成を,neutral
4192,じゃ書類作成を,君らの精神が健全だと証言する証人もいる,neutral
4193,君らの精神が健全だと証言する証人もいる,問題なし,neutral
4194,問題なし,それと2人で判事の審査を,neutral
4195,それと2人で判事の審査を,彼女抜きの審査はダメ?,surprise
4196,彼女抜きの審査はダメ?,手続き済みだと言っちゃった,fear
4197,フィービーは7ドル 50モニカは10ドルー レイチェルは15ドルの負け,新しい手を教わって楽しかったよ,neutral
4198,新しい手を教わって楽しかったよ,のろ呪われたお金で支払うわね」,neutral
4199,のろ呪われたお金で支払うわね」,使うと不幸が起こるわ,neutral
4200,使うと不幸が起こるわ,どうせ俺不幸だもん,neutral
4201,どうせ俺不幸だもん,映画で厄払いする,neutral
4202,映画で厄払いする,残るはグリーンさん15ドル頂きますよ,neutral
4203,早速切る?,お願い,joy
4204,お願い,今度は確認したいの 今のはフォーウェディングの人?,neutral
4205,今度は確認したいの 今のはフォーウェディングの人?,あれはロディマクダウェルよ アンディは猿の惑星の男優,neutral
4206,あれはロディマクダウェルよ アンディは猿の惑星の男優,あの人ねありがと,neutral
4207,あの人ねありがと,こちらこそ,neutral
4208,君と会わないことだ,そんなの無理よ,surprise
4209,そんなの無理よ,どう返事を?,sadness
4210,どう返事を?,もう返事しちゃったのね,sadness
4211,もう返事しちゃったのね,どうしてもやり直さなきゃ,sadness
4212,どうしてもやり直さなきゃ,ラッキーだわ 「いいニュースね」 犬の訃報以来の朗報よ,surprise
4213,ラッキーだわ 「いいニュースね」 犬の訃報以来の朗報よ,なるほどねなら,anger
4214,なるほどねなら,2出,anger
4215,2出,ここは君んちだ,neutral
4216,ここは君んちだ,キレちゃったのよ,anger
4217,若草物語って ワオ!,気に入った?,neutral
4218,気に入った?,ジョーの原稿が燃やされた彼はエイミーを許さないぞ,joy
4219,ジョーの原稿が燃やされた彼はエイミーを許さないぞ,ジョセフィーヌの略,neutral
4220,チャンドラー,モニカ,neutral
4221,モニカ,コーヒーを,neutral
4222,コーヒーを,仕事はしないの?,joy
4223,仕事はしないの?,あんまりね,neutral
4224,あんまりね,遊びの計画は?,neutral
4225,遊びの計画は?,きずな絆になる思い出を作りたいわ,joy
4226,きずな絆になる思い出を作りたいわ,タイムズスクエアで忍者スターを見て一,neutral
4227,タイムズスクエアで忍者スターを見て一,風俗ギャルの写真を撮りたい,neutral
4228,風俗ギャルの写真を撮りたい,都会のだいご味だ,neutral
4229,チャンドラーの星占いを読むわ 5日特別な人が贈り物をくれる,お礼言っとく,joy
4230,お礼言っとく,12日恋人とロゲンカ きっと私の贈り物をバカにするのよ ひどいわ,surprise
4231,12日恋人とロゲンカ きっと私の贈り物をバカにするのよ ひどいわ,しかも19日ナゾの色女が出現だって,surprise
4232,しかも19日ナゾの色女が出現だって,マックチーズジョーイトリビアーニだわ,surprise
4233,マックチーズジョーイトリビアーニだわ,ロボットを相棒に偽の犯罪と闘う覚悟はできた?,joy
4234,ロボットを相棒に偽の犯罪と闘う覚悟はできた?,覚悟できたかって? 長年待った主役だぞ ビビッてるよ,joy
4235,覚悟できたかって? 長年待った主役だぞ ビビッてるよ,うまくいくわよ,neutral
