,prev_line,current_line,tone
1935,こちらWXRKKロック局だぜ クイズで賞金100ドルだ,同居人は後悔してるが彼の名は?,neutral
1936,ジョセフフランシストリビアーニいるの?,留守よ何ごと?,joy
1937,留守よ何ごと?,レイチェルカレングリーンジョーイが約束を破ったの,neutral
1938,レイチェルカレングリーンジョーイが約束を破ったの,フィービー行けないデート またねパパ,anger
1939,フィービー行けないデート またねパパ,新しいあだ名よ,neutral
1940,新しいあだ名よ,僕も自分のを考えたロストロンだ,joy
1941,僕も自分のを考えたロストロンだ,ジョセフフランシス!,joy
1942,ジョセフフランシス!,ミドルネーム攻めか? メモは残しただろ,surprise
1943,ミドルネーム攻めか? メモは残しただろ,友達よりエッチが優先だよ,anger
1944,友達よりエッチが優先だよ,暗黙のルールだ,neutral
1945,暗黙のルールだ,認めないわ,anger
1946,認めないわ,約束は守らなきゃダメ,anger
1947,約束は守らなきゃダメ,デートなんて許せない,anger
1948,デートなんて許せない,一時の恋人より一生の友達でしょ,anger
1949,いたの知ってた? ううん,俺らいつ帰った? 30分前,neutral
1950,俺らいつ帰った? 30分前,ステキ,neutral
1951,ライト ロマンティックなライト,例の話についてだけど,neutral
1952,例の話についてだけど,完ぺきに忘れてたわ,neutral
1953,完ぺきに忘れてたわ,この件はずいぶん悩んだ 人生まで考えた,neutral
1954,この件はずいぶん悩んだ 人生まで考えた,僕はビジネスの世界を制して一 知的分野では成功した 世界一の美女も手にした,anger
1955,僕はビジネスの世界を制して一 知的分野では成功した 世界一の美女も手にした,だが不足が,sadness
1956,だが不足が,それは?,neutral
1957,それは?,肉体的な分野での成功だ,neutral
1958,肉体的な分野での成功だ,というと?,neutral
1959,というと?,モニカ 僕が目指すのは一 アルティメットの王者だ,neutral
1960,モニカ 僕が目指すのは一 アルティメットの王者だ,それ何?,surprise
1961,それ何?,最も危険で過酷な格闘技だ 49州で禁止されてる,joy
1962,最も危険で過酷な格闘技だ 49州で禁止されてる,どういうこと?,surprise
1963,どういうこと?,すでにジークンドーという武術と一 ストリートファイトを習いリングも作った,neutral
1964,すでにジークンドーという武術と一 ストリートファイトを習いリングも作った,そのリングなわけね,joy
1965,そのリングなわけね,リングサイドで応援して一,joy
1966,リングサイドで応援して一,血のにおいをかいでくれ,joy
1967,血のにおいをかいでくれ,どう?,neutral
1968,どう?,両親が喜ぶわ,disgust
1969,入っても?,好きにしてロジャーはまた呼び出しよ,neutral
1970,好きにしてロジャーはまた呼び出しよ,呼んだのは誰?,neutral
1971,呼んだのは誰?,ひぞう脾臓破裂は俺,sadness
1972,ひぞう脾臓破裂は俺,どうして? あいつはよせ,joy
1973,どうして? あいつはよせ,俺と付き合え,sadness
1974,俺と付き合え,自分の気持ちに気づいた,sadness
1975,自分の気持ちに気づいた,ゆうべみたいな関係って俺には初めてだった,neutral
1976,ゆうべみたいな関係って俺には初めてだった,前の2人の女とは一,neutral
1977,前の2人の女とは一,翌朝にはすぐ友達と遊びたくなった 君とだと一 友達も兼ねてる,neutral
1978,翌朝にはすぐ友達と遊びたくなった 君とだと一 友達も兼ねてる,でも彼氏に向かないかもね 冗談ばっかで 真剣な交際の経験もないし医者でもない,sadness
1979,でも彼氏に向かないかもね 冗談ばっかで 真剣な交際の経験もないし医者でもない,本当の数は1人?,neutral
1980,本当の数は1人?,2人だ,neutral
1981,2人だ,私込み?,surprise
1982,お帰り,続きをやらない?,joy
1983,続きをやらない?,まだ疲れが残ってる,neutral
1984,まだ疲れが残ってる,セックスで,neutral
1985,セックスで,誰がした?,surprise
1986,誰がした?,俺たち,joy
1987,俺たち,してない,surprise
1988,してない,じゃさっきの相手は君とうり二つの,neutral
1989,ウソでしょ 勘弁して,でなきゃあんな高い金は取らない,surprise
1990,私がママよ,モニカはチャンドラーを拒んでた,neutral
1991,モニカはチャンドラーを拒んでた,でもその後は知らないや,neutral
1992,でもその後は知らないや,それとロスの彼女ボニーがハゲになった,neutral
1993,それとロスの彼女ボニーがハゲになった,ロスはレイチェルとキスして心が揺れてた その後は知らない,neutral
1994,ロスはレイチェルとキスして心が揺れてた その後は知らない,チャンドラーに聞くよ,neutral
1995,ホント? さっきのはウソ,自分の本心分かった?,neutral
1996,自分の本心分かった?,危険な手ね,surprise
1997,危険な手ね,じゃ産むの?,fear
1998,じゃ産むの?,ええ産むわよ,joy
1999,ええ産むわよ,誰の子を? それはまだダメ,neutral
2000,ガーファンクル 僕が何を? 私をけなした,いつけなした?,neutral
2001,いつけなした?,思い出したチェスのときよ,surprise
2002,思い出したチェスのときよ,チェスなどしてないよ,neutral
2003,チェスなどしてないよ,真冬の湖でチェスの最中に君は退屈なやつだ,neutral
2004,真冬の湖でチェスの最中に君は退屈なやつだ,仮面を取ったらキャメロンディアスで,anger
2005,仮面を取ったらキャメロンディアスで,夢だったかもね,neutral
2006,干渉する人とは暮らせない,あんたのことよ,anger
2007,あんたのことよ,分かってた,neutral
2008,分かってた,私を拒むなんてゲイ?,anger
2009,私を拒むなんてゲイ?,元気で,neutral
2010,元気で,ジルが帰った 栓が閉まらない,sadness
2011,とっとと出てけ!,バカげてるわ あんたの物を詰める!,anger
2012,バカげてるわ あんたの物を詰める!,話した?,neutral
2013,話した?,モニカが引っ越すわ,joy
2014,モニカが引っ越すわ,ウソよ,anger
2015,ウソよ,じゃ何で荷造りを?,surprise
2016,じゃ何で荷造りを?,2人の気持ちは分かった,neutral
2017,2人の気持ちは分かった,怒りだけよ ずっと底のほう,neutral
2018,怒りだけよ ずっと底のほう,なら続けて,neutral
2019,全員ね,旅行の話に飽きた?,neutral
2020,旅行の話に飽きた?,行けなかったのがシャクなの妊娠なんてもうウンザリ,sadness
2021,行けなかったのがシャクなの妊娠なんてもうウンザリ,明日デートよ,neutral
2022,明日デートよ,ほらね兄さんを克服よ,joy
2023,もうヘロヘロだ,部屋で足を冷やせば回復するよ,neutral
2024,部屋で足を冷やせば回復するよ,ありがと,neutral
2025,ありがと,優しいのね,joy
2026,優しいのね,本当に優しい男性って滅多にいないわ,anger
2027,本当に優しい男性って滅多にいないわ,俺一人で大車輪の活躍さ,neutral
2028,俺一人で大車輪の活躍さ,名前はジョーイ?,neutral
2029,名前はジョーイ?,優しいのは僕だ,surprise
2030,優しいのは僕だ,子供と踊りまくった,surprise
2031,子供と踊りまくった,小さい足だな!,neutral
2032,ここには友達のロスが来る,ゲラー博士?,neutral
2033,ゲラー博士?,博士?新しいニックネームか,surprise
2034,博士?新しいニックネームか,ここには座らないわ,neutral
2035,ここには座らないわ,白衣組はあっちよ ここは青い上着組なの,neutral
2036,落としたんだ 犬をひいたせいだ,キャシーに謝りたい,sadness
2037,キャシーに謝りたい,ジョーイだ,neutral
2038,ジョーイだ,いいのよ気にしないで,neutral
2039,いいのよ気にしないで,やめて謝ることない,neutral
2040,やめて謝ることない,じゃ明日,neutral
2041,じゃ明日,帰るわ,neutral
2042,帰るわ,バッグ忘れて,neutral
2043,バッグ忘れて,本当に忘れたの,neutral
2044,新居で出直しです 職場のみんなもここに招きたい,立ち直ってよかった」,joy
2045,立ち直ってよかった」,二度とキレる心配はありませんよ」,neutral
2046,二度とキレる心配はありませんよ」,復職の時期はいつごろかな?,neutral
2047,おっぱい,買うわ 秘宝をもう1箱 秘宝は?,neutral
2048,買うわ 秘宝をもう1箱 秘宝は?,売り切れだ,neutral
2049,売り切れだ,そんなのイヤ あと2箱だけ,anger
2050,そんなのイヤ あと2箱だけ,大した量じゃない,fear
2051,大した量じゃない,助けると思って,sadness
2052,助けると思って,もう2重アゴだ,disgust
2053,もう2重アゴだ,517箱だよ どう売りさばいた?,surprise
2054,517箱だよ どう売りさばいた?,博物館でレーザーで見るフロイトショーのあとに一 出口で50箱も売れた,joy
2055,博物館でレーザーで見るフロイトショーのあとに一 出口で50箱も売れた,小腹のすいた客が狙い目なんだよ そこで夜中に大学の寮へ訪問販売さ,joy
2056,小腹のすいた客が狙い目なんだよ そこで夜中に大学の寮へ訪問販売さ,ダンボールごと売れて一,joy
2057,ダンボールごと売れて一,クッキー野郎と呼ばれた,joy
2058,クッキー野郎と呼ばれた,順に封筒に入れて切手をはって,neutral
2059,順に封筒に入れて切手をはって,履歴書の印刷は誰が?,surprise
2060,履歴書の印刷は誰が?,俺がパソコンで,joy
2061,石けんにシャンプー持ち帰る気か?,宿泊者の権利だ,neutral
2062,宿泊者の権利だ,使わないだろ,surprise
2063,使わないだろ,これは? 裁縫セット,joy
2064,これは? 裁縫セット,やるね,joy
2065,やるね,カメラは? カメラって?,sadness
2066,カメラは? カメラって?,撮るよう頼んだろ,surprise
2067,撮るよう頼んだろ,聞いてない,neutral
2068,聞いてない,ケーキカットの前に頼んだ,surprise
2069,ケーキカットの前に頼んだ,君が頼みがある 言った時にー 叔父さんが小切手持ってきた,neutral
2070,君が頼みがある 言った時にー 叔父さんが小切手持ってきた,お前は小切手より大切手くれと言った,neutral
2071,お前は小切手より大切手くれと言った,その笑いも聞いた,neutral
2072,その笑いも聞いた,じゃカメラは?,surprise
2073,じゃカメラは?,持ってない,sadness
2074,持ってない,モニカに怒られるよ,surprise
2075,モニカに怒られるよ,緒にホテルの中を捜そう,neutral
2076,緒にホテルの中を捜そう,3分待って,anger
2077,レイチェル両親だ,初めまして,joy
2078,初めまして,渡した食費でご商売の女性を買ったの?,neutral
2079,渡した食費でご商売の女性を買ったの?,この服のせい?それは誤解ですわ,joy
2080,この服のせい?それは誤解ですわ,服飾業界で働いてまして最新のドレスなんです,neutral
2081,服飾業界で働いてまして最新のドレスなんです,ミラノで流行中ですのよ 着用して周りの反応を調べるのが仕事で一 結果をあとで上司に報告しますの,neutral
2082,ミラノで流行中ですのよ 着用して周りの反応を調べるのが仕事で一 結果をあとで上司に報告しますの,LAならはやるわ,neutral
2083,LAならはやるわ,言えてる 食事は?,neutral
2084,言えてる 食事は?,先にやろうって,neutral
2085,先にやろうって,まだです 一緒に食べに行こう,neutral
2086,まだです 一緒に食べに行こう,家でゴロゴロするよりいいですわね,neutral
2087,家でゴロゴロするよりいいですわね,じゃ出かけよう,neutral
2088,じゃ出かけよう,食事の席だし一 ぜひその格好で来てほしいな,neutral
2089,口答えする前に家族のことを考えるんだった,もういい,anger
2090,もういい,ピーピー,joy
2091,トリスカイデカフォビア,トリスキットクラッカー恐怖症,neutral
2092,トリスキットクラッカー恐怖症,数字の13への恐怖症だ クラッカー?,neutral
2093,数字の13への恐怖症だ クラッカー?,角が鋭くて怖いじゃん,neutral
2094,角が鋭くて怖いじゃん,チャンドラーの番だ,neutral
2095,チャンドラーの番だ,天使のパス解答権を取り戻すぞ,joy
2096,天使のパス解答権を取り戻すぞ,無茶苦茶なルールだ,anger
2097,無茶苦茶なルールだ,負け惜しみか?,joy
2098,負け惜しみか?,熱中した時点で敗者だよ,neutral
2099,熱中した時点で敗者だよ,ルーレットを回すかぎょろ目カードを引くか,neutral
2100,ルーレットを回すかぎょろ目カードを引くか,考える どうでもいい,anger
2101,考える どうでもいい,選んでよ,neutral
2102,選んでよ,どっちでもいい 選べドアホめ,neutral
2103,どっちでもいい 選べドアホめ,カードにする ちょうだいカードロスの全得点を奪える,neutral
2104,カードにする ちょうだいカードロスの全得点を奪える,ルールが変だカードで得点が移るなんて,neutral
2105,ルールが変だカードで得点が移るなんて,出場者同士の話は厳禁だ,neutral
2106,うまいぞリアルな演技だ,違うよ君に振ったんじゃない,neutral
2107,違うよ君に振ったんじゃない,いや君だ 向かいのいい女が熱い視線を,surprise
2108,いや君だ 向かいのいい女が熱い視線を,負けずにバシバシ送れ,joy
2109,負けずにバシバシ送れ,かますとこ,joy
2110,かますとこ,いくぞ,fear
2111,いくぞ,やあ 元气,neutral
2112,やあ 元气,通じた手を振ってる,joy
2113,通じた手を振ってる,すぐ行くよ,joy
2114,すぐ行くよ,そこは3階の,neutral
2115,そこは3階の,かわいいコね 言ったろ,surprise
2116,かわいいコね 言ったろ,これは彼女じゃないただのモニカだ,disgust
2117,人が見ても次の瞬間その人はいない,自分を解放できてそう快だわ,joy
2118,冷たくしないでよ」 向かいに越しただけだ,服はまだ?,surprise
2119,服はまだ?,俺って裸?,surprise
2120,俺って裸?,15分で親が来るわ,neutral
2121,15分で親が来るわ,分かってる彼らと話してたが一 うちに招いていい?,neutral
2122,分かってる彼らと話してたが一 うちに招いていい?,アレルギーよ,surprise
2123,アレルギーよ,そっか、アレルギーだね 彼女のせいだ,neutral
2124,ソーダが切れた,買いにいこうか?,neutral
2125,買いにいこうか?,ご対面した?,neutral
2126,ご対面した?,フィービーは実のママだった,sadness
2127,フィービーは実のママだった,タツノオトシゴだ,neutral
2128,タツノオトシゴだ,どういうこと?,surprise
2129,どういうこと?,ママは私を捨てた女だった,sadness
2130,ママは私を捨てた女だった,ここで話してスッキリしたら?,surprise
2131,ここで話してスッキリしたら?,今は独りになりたい,sadness
2132,開けて,大金だ,joy
2133,大金だ,結婚したとは初耳だ,joy
2134,結婚したとは初耳だ,式に呼ばれなかったわ 親と友達数人だけでやったんです,neutral
2135,ねえうちの店へ食事に来たい?,行きたい,joy
2136,行きたい,無理よ,neutral
2137,無理よ,来月まで空きなし 私もマッサージできない免停中なの,sadness
2138,来月まで空きなし 私もマッサージできない免停中なの,どうして?,neutral
2139,どうして?,オイルの量が多すぎて手が滑っただけよ,neutral
2140,オイルの量が多すぎて手が滑っただけよ,緊急発表だ 荷造りして,joy
2141,緊急発表だ 荷造りして,ウソでしょ 離婚は7年後のはずよ,surprise
2142,いい気持ち,ホントね,joy
2143,ホントね,こんなに柔らかいとは これ綿100,joy
2144,こんなに柔らかいとは これ綿100,しかもセール品,joy
2145,しかもセール品,救助員が爆弾を解体するのを見に帰るよ,neutral
2146,救助員が爆弾を解体するのを見に帰るよ,あとで飲まない?,neutral
2147,あとで飲まない?,いいね 言っとくが彼氏なら今に,neutral
2148,いいね 言っとくが彼氏なら今に,分かってる,neutral
2149,逃げるな! はっきりしろレイチェルを妊娠させたな,妊娠させた?,surprise
2150,妊娠させた?,誰が? お前だ!,surprise
2151,誰が? お前だ!,でも一晩限りの関係だ 何でもない,fear
2152,でも一晩限りの関係だ 何でもない,本心か?娘には価値がないと?,anger
2153,本心か?娘には価値がないと?,彼女は大事な人です 愛してますよ,fear
2154,彼女は大事な人です 愛してますよ,僕は求婚した,joy
2155,僕は求婚した,このクソ女と交際するためか?,surprise
2156,このクソ女と交際するためか?,モナです 彼はドクターグリーン,joy
2157,夜遅くに電話したのは」,ウィーナスが心配だからだ,anger
2158,ウィーナスが心配だからだ,何だと?上司の俺に口答えは禁止だ,anger
2159,何だと?上司の俺に口答えは禁止だ,ヤダー,surprise
2160,いかが?,アナベル 新人に会った?,neutral
2161,飼ってないくせに,なら 注意します,neutral
2162,なら 注意します,じゃ晩さん会に戻るよ」,neutral
2163,じゃ晩さん会に戻るよ」,バイバイ,neutral
2164,バイバイ,ジャニスだ,neutral
2165,ジャニスだ,あれは難癖じゃない,neutral
2166,あれは難癖じゃない,懐かしいわ ハロチャンドラー,neutral
2167,懐かしいわ ハロチャンドラー,ヤダマジ?ウソ,surprise
2168,ヤダマジ?ウソ,もうダメ そこよ いいわもっと速く,joy
2169,もうダメ そこよ いいわもっと速く,やめて音など立ててないわ,neutral
2170,やめて音など立ててないわ,勝った,joy
2171,勝った,ヘッケルさんが?,neutral
2172,ヘッケルさんが?,死因は? ホウキを持って倒れてた,neutral
2173,死因は? ホウキを持って倒れてた,そんな,anger
2174,そんな,掃除中に死ぬなんてな 俺も気をつけよう,neutral
2175,掃除中に死ぬなんてな 俺も気をつけよう,掃除で死ぬとはね,neutral
2176,大丈夫?,チャンドラーは? 一人で悲しむって,neutral
2177,チャンドラーは? 一人で悲しむって,自由の身だ!,joy
2178,自由の身だ!,悲しんでる,neutral
2179,ジャムを作ってるの,朝4時からよ 果物はどこで?,surprise
2180,朝4時からよ 果物はどこで?,港なら朝から卸値で買える,neutral
2181,港なら朝から卸値で買える,港なんてあった?,surprise
2182,港なんてあった?,骨折か?,sadness
2183,骨折か?,いやでも2週間固定しなきゃ,joy
2184,いやでも2週間固定しなきゃ,医者にベッドから落ちたと?,neutral
2185,医者にベッドから落ちたと?,こいつが売った,sadness
2186,こいつが売った,医者が信じるとはねソケットから落ちた,anger
2187,医者が信じるとはねソケットから落ちた,これ何?果物?,surprise
2188,これ何?果物?,ジャムよ,neutral
2189,ジャムよ,貧しいからよ,neutral
2190,貧しいからよ,これで商売して立ち直るわ,neutral
2191,これで商売して立ち直るわ,失恋を乗り越えるの,anger
2192,失恋を乗り越えるの,泣きやむの次はジャム!,neutral
2193,泣きやむの次はジャム!,熱いわよ,fear
2194,熱いわよ,全部俺の分だ,neutral
2195,まだ怒ってた?,ロスにゴーグルまで借りといて,neutral
2196,ロスにゴーグルまで借りといて,ないと目が痛い,surprise
2197,どうぞ私が作った特製ブラウニーよ,もらう,neutral
2198,もらう,遠慮する,neutral
2199,遠慮する,違うわ歯痛よ,sadness
2200,違うわ歯痛よ,もらう,neutral
2201,もらう,歯科医を紹介するよ,neutral
2202,歯科医を紹介するよ,私の先生も名医よでも会えない,fear
2203,私の先生も名医よでも会えない,透明な歯科医だってさ,neutral
2204,透明な歯科医だってさ,どうして?,surprise
2205,どうして?,私が歯医者に行くたびに人が死ぬの,anger
2206,私が歯医者に行くたびに人が死ぬの,俺は行くたびに衛生士さんの胸元見ちゃう,joy
2207,俺は行くたびに衛生士さんの胸元見ちゃう,フィービーそれって一,surprise
2208,フィービーそれって一,メアリーおばさんも郵便屋さんのジョンも一 カウボーイのボブもよ,neutral
2209,メアリーおばさんも郵便屋さんのジョンも一 カウボーイのボブもよ,3人とも死んだの?,surprise
2210,3人とも死んだの?,私が治療中にね,sadness
2211,私が治療中にね,私がフロスを欠かさないのは人の命を救うためよ,neutral
2212,私がフロスを欠かさないのは人の命を救うためよ,フィービーは悪くない 治療中にその3人が死んだのは偶然だよ,neutral
2213,フィービーは悪くない 治療中にその3人が死んだのは偶然だよ,3人に言ってあの世だわ,sadness
2214,ロス,いいんだ,joy
2215,いいんだ,あなたに話があるの 彼がいるのよ,joy
2216,あなたに話があるの 彼がいるのよ,その言葉イギリスも同じ意味?,sadness
2217,ダメよ 楽しめそうにない,誕生日には皆がいないと,sadness
2218,誕生日には皆がいないと,帰ろう,neutral
2219,帰ろう,1曲だけ聴いてやるか,neutral
2220,1曲だけ聴いてやるか,帰るのは失礼だ,neutral
2221,帰るのは失礼だ,水さすものね,neutral
2222,3人は決定だ,3人って?,neutral
2223,3人って?,寝たい有名人,neutral
2224,寝たい有名人,じっくり考えたわね,surprise
2225,じっくり考えたわね,あと2人が難しい,neutral
2226,あと2人が難しい,誰に絞った?,neutral
2227,誰に絞った?,エリザベスハーリー,joy
2228,エリザベスハーリー,目悪い?,surprise
2229,目悪い?,スーザンサランドン,neutral
2230,スーザンサランドン,彼女は福祉に熱心だ 寝たきゃ食糧を寄付しろ,disgust
2231,彼女は福祉に熱心だ 寝たきゃ食糧を寄付しろ,イザベラロッセリーニ,joy
2232,イザベラロッセリーニ,ホットでセクシーだが一 国際派で飛び回ってる,joy
2233,ホットでセクシーだが一 国際派で飛び回ってる,それが?,neutral
2234,それが?,出会う機会がない国内にいる人を選べ,neutral
2235,出会う機会がない国内にいる人を選べ,イザベラと寝れないのは距離の問題?,neutral
2236,これで5人の妊婦が5人の子を産んだわ 私はゼロよ なぜ出ないの?,僕が思うに一,neutral
2237,僕が思うに一,君のお腹が居心地よくて離れたくないんだ」,neutral
2238,君のお腹が居心地よくて離れたくないんだ」,ふざけたセリフね,sadness
2239,ふざけたセリフね,21時間経過ね ヒーローだわ,neutral
2240,21時間経過ね ヒーローだわ,先生何とかしてよ火をつけていぶり出すとか,sadness
2241,先生何とかしてよ火をつけていぶり出すとか,10センチ開いてるママになる時よ,neutral
2242,10センチ開いてるママになる時よ,どうしよう 勝ったぞザマ見ろ!,surprise
2243,2人はどこなの?,2人が来るまで付いてるわ,neutral
2244,搭乗券は?,ないわ 友達に話が,neutral
2245,ないわ 友達に話が,申し訳ありませんが通せません,neutral
2246,申し訳ありませんが通せません,でも友達は行ったばかりなの,sadness
2247,でも友達は行ったばかりなの,規則ですから,anger
2248,規則ですから,じゃお願いだから彼に伝言して 大事な話なの,neutral
2249,じゃお願いだから彼に伝言して 大事な話なの,何とお伝えを?,neutral
2250,何とお伝えを?,分かんない,neutral
2251,分かんない,失礼お客様,neutral
2252,失礼お客様,レイチェル様がプレゼント うれしかった,neutral
2253,レイチェル様がプレゼント うれしかった,トビーレイチェルなんて知らないよ,surprise
2254,俺たちは合わないよ,俺はビンビン君はブンブン,neutral
2255,俺はビンビン君はブンブン,何てことを! ごめんよ 大丈夫?,anger
2256,何てことを! ごめんよ 大丈夫?,コンタクトがズレたわ すぐ戻る,sadness
2257,コンタクトがズレたわ すぐ戻る,困ったわね 何目?,surprise
2258,困ったわね 何目?,さあね100万杯?,anger
2259,さあね100万杯?,ダメよ 楽しいこと考えて,neutral
2260,ダメよ 楽しいこと考えて,もう平気だ,neutral
2261,もう平気だ,ヤバい もう来た,fear
2262,ヤバい もう来た,任せて深呼吸よ,neutral
2263,任せて深呼吸よ,どうやったの?,surprise
2264,どうやったの?,才能だわね,neutral
2265,才能だわね,ぜひまたコンビを,neutral
2266,ぜひまたコンビを,楽しそう,neutral
