,prev_line,current_line,tone
6054,兄さんがまだよ,ロスにはまだ秘密に,neutral
6055,マリーアンジェラへ,「元気かい?,neutral
6056,「元気かい?,別れ話か?,disgust
6057,別れ話か?,ジョーイが知ったらどうする?,anger
6058,ジョーイが知ったらどうする?,渡仏したと伝えてよ キューバへ逃げる,neutral
6059,渡仏したと伝えてよ キューバへ逃げる,手紙じゃなく直接話すべきだ,neutral
6060,手紙じゃなく直接話すべきだ,家へ行って家人に取り次ぎを頼め 彼女が玄関に来たら外へ誘って話だ,neutral
6061,家へ行って家人に取り次ぎを頼め 彼女が玄関に来たら外へ誘って話だ,本人に取り次ぎを頼んだら?,fear
6062,本人に取り次ぎを頼んだら?,キューバへ,sadness
6063,予想は当たりだ,やっぱね部屋で何が? キスされた,surprise
6064,やっぱね部屋で何が? キスされた,キスしたの?,surprise
6065,俺はQが2枚お前は?,2と5だ,neutral
6066,2と5だ,お前の勝ちだ,joy
6067,お前の勝ちだ,マジだ 次いこう,neutral
6068,マジだ 次いこう,お前の手は? 4と9,neutral
6069,お前の手は? 4と9,すごいな,surprise
6070,すごいな,回T? フルカップ,neutral
6071,回T? フルカップ,俺って天才,joy
6072,どこなの? まだスタジオ,式まで1時間もないITO,anger
6073,式まで1時間もないITO,分かってる相手役が酔ってて出られない,sadness
6074,分かってる相手役が酔ってて出られない,ほかの司祭を探さなきゃ,sadness
6075,ほかの司祭を探さなきゃ,司祭は俺だ! 電話で式を挙げよう,anger
6076,司祭は俺だ! 電話で式を挙げよう,切るわよ,sadness
6077,切るわよ,切ったら君を俺と結婚させるぞ,anger
6078,何を見てるの?,ベガス行きのルートだ 旅慣れてるよね?,neutral
6079,ベガス行きのルートだ 旅慣れてるよね?,経験豊富よ,neutral
6080,経験豊富よ,北回りと南回りのどっちがお薦め?,neutral
6081,北回りと南回りのどっちがお薦め?,北にはハチをあごヒゲにした男が,neutral
6082,北にはハチをあごヒゲにした男が,じゃ北回りだ,joy
6083,仕事をくださいよ 健康保険が切れた,まず悪いうわさを消さなきゃ,neutral
6084,まず悪いうわさを消さなきゃ,あんたが干されるよう誰かさんが一 悪口をばらまいたの,sadness
6085,あんたが干されるよう誰かさんが一 悪口をばらまいたの,誰だよ!,anger
6086,モニカたちは洗濯や買い物を口実にいつもエッチを?,友達と長電話も口実?,surprise
6087,友達と長電話も口実?,電話でもヤッてる,joy
6088,電話でもヤッてる,よかったじゃん,surprise
6089,よかったじゃん,チャンドラーがモニカの手ほどき受けられた,joy
6090,チャンドラーがモニカの手ほどき受けられた,どうも ジョーイ来て,neutral
6091,どうも ジョーイ来て,フィービーにもバレたの,neutral
6092,フィービーにもバレたの,2人はただの友達だ,neutral
6093,2人はただの友達だ,もういいのよ,neutral
6094,もういいのよ,レイチェルにバレたこと2人は?,surprise
6095,レイチェルにバレたこと2人は?,知らないけどもう関係ない,neutral
6096,知らないけどもう関係ない,みんなにバレたんだから秘密にするのは終わりだ,neutral
6097,結婚で大変化が起こるわね,そんなに?,surprise
6098,そんなに?,変わるわよ,surprise
6099,変わるわよ,2人に子供ができたら子持ちの友達と付き合い出して一,sadness
6100,2人に子供ができたら子持ちの友達と付き合い出して一,郊外のボルボの店のそばに引っ越しちゃうのよ,sadness
6101,郊外のボルボの店のそばに引っ越しちゃうのよ,それは大変化ね,neutral
6102,それは大変化ね,落ち着いて,neutral
6103,外出中かな?,長期の旅行かも,sadness
6104,長期の旅行かも,死ぬわ,fear
6105,死ぬわ,それは困る,neutral
6106,それは困る,助けなきゃ,neutral
6107,助けなきゃ,持ってこう,neutral
6108,持ってこう,素早くね,fear
6109,素早くね,回T? 中で音がした,fear
6110,キック野郎,何だよ パンツ履くと寝心地悪い,neutral
6111,何だよ パンツ履くと寝心地悪い,脱ぐなよ,neutral
6112,脱ぐなよ,俺の毎日って女が入り乱れてるだろ,neutral
6113,俺の毎日って女が入り乱れてるだろ,レズ物好きだもんな,neutral
6114,レズ物好きだもんな,違うよ次々と女を換えるけど一,neutral
6115,違うよ次々と女を換えるけど一,いつか理想の女に出会って一途になれると思ってた,sadness
6116,いつか理想の女に出会って一途になれると思ってた,でも親父を見たら,neutral
6117,でも親父を見たら,親父とは違うよ,neutral
6118,親父とは違うよ,お前は配管の家業を継いだか?,neutral
6119,お前は配管の家業を継いだか?,売れない役者業に飛び込んだ,neutral
6120,売れない役者業に飛び込んだ,反対を押し切ってだ,neutral
6121,反対を押し切ってだ,そのガッツがあれば結婚後も誘惑に負けないさ 悪いね売約済だって,neutral
6122,そのガッツがあれば結婚後も誘惑に負けないさ 悪いね売約済だって,信じてるよ,neutral
6123,信じてるよ,ありがと,neutral
6124,ありがと,離れろ,anger
6125,粉チーズを全部使ったの?,使ったって食べたって意味?,neutral
6126,使ったって食べたって意味?,生クリームも?,neutral
6127,生クリームも?,チーズでノド渇いて,neutral
6128,チーズでノド渇いて,いいわ続けて,neutral
6129,いいわ続けて,モニカのキッチンはいいにおいね 味も最高 前に作ったことある?,surprise
6130,モニカのキッチンはいいにおいね 味も最高 前に作ったことある?,一人じゃお湯も沸かせない,neutral
6131,一人じゃお湯も沸かせない,立派なシェフね,joy
6132,立派なシェフね,聞き取れませんでした 立派な何です? シェフよ,neutral
6133,聞き取れませんでした 立派な何です? シェフよ,でしょ,joy
6134,フィービー,調子は?,neutral
6135,調子は?,いいわロジャーがみんなを夕食に呼ぶって,joy
6136,いいわロジャーがみんなを夕食に呼ぶって,どうかした? 愛人なの,neutral
6137,どうかした? 愛人なの,ロジャーが,neutral
6138,ロジャーが,何というか,neutral
6139,何というか,俺たちとしては,neutral
6140,俺たちとしては,ごめんよ,sadness
6141,ごめんよ,いいの,neutral
6142,いいの,彼が鋭いからみんなビビッたんでしょ?,neutral
6143,彼が鋭いからみんなビビッたんでしょ?,悪いわね,sadness
6144,俺のだ,ナンパした女のじゃ?,neutral
6145,ナンパした女のじゃ?,それ頂く,sadness
6146,それ頂く,お前が分からなくなった,anger
6147,お前が分からなくなった,この際聞くぞ お前の言葉を信じるからちゃんと答えろ,neutral
6148,この際聞くぞ お前の言葉を信じるからちゃんと答えろ,出張って本当は一 男あさりの旅か?,anger
6149,モニカが? 急いで探しても満足な式場がない,延期?,joy
6150,延期?,モニカは今までにかかった費用を知らない,anger
6151,モニカは今までにかかった費用を知らない,妹の小さな脳ミソじゃ理解不能だ 招待客だって休みを取って遠路はるばる来たんだよ,anger
6152,妹の小さな脳ミソじゃ理解不能だ 招待客だって休みを取って遠路はるばる来たんだよ,おかしい,neutral
6153,おかしい,皆さんガッカリよね でもまた来てくれる,sadness
6154,皆さんガッカリよね でもまた来てくれる,君は延期だとみんなに言えるの?,anger
6155,君は延期だとみんなに言えるの?,ズボンをどけて,anger
6156,ズボンをどけて,だってまともな式場は予約でいっぱいだわ,anger
6157,だってまともな式場は予約でいっぱいだわ,私たちの大事な式なのよ,anger
6158,私たちの大事な式なのよ,延期は論外だ 結婚するのは今しかない,neutral
6159,延期は論外だ 結婚するのは今しかない,じゃしない気?,anger
6160,じゃしない気?,今だってこと,neutral
6161,今だってこと,ダメなら? ダメじゃない なぜ後ろを向く!,anger
6162,ダメなら? ダメじゃない なぜ後ろを向く!,後ろ向きなのはあなたよ,anger
6163,後ろ向きなのはあなたよ,気持ちが通じないなら結婚は水に流しましょ,anger
6164,気持ちが通じないなら結婚は水に流しましょ,エミリー待ってよ,sadness
6165,ただいま,またね,neutral
6166,またね,夕食作るわ,joy
6167,夕食作るわ,先に言ってよ 聞いてないよ,anger
6168,先に言ってよ 聞いてないよ,美術館の者ですがモニカさんにお知らせです,neutral
6169,美術館の者ですがモニカさんにお知らせです,キャンセルが出たのでビンググラー家の挙式は 聞いたはずない,neutral
6170,キャンセルが出たのでビンググラー家の挙式は 聞いたはずない,チャンドラーピングだ!,surprise
6171,チャンドラーピングだ!,ヤだ!,anger
6172,母さん何か?,これ届けに,neutral
6173,これ届けに,指輪が,surprise
6174,毎日よ私の声を教えてるの,じゃ僕の話題も?,neutral
6175,じゃ僕の話題も?,あなたの呼び名は一 精子提供者よ,neutral
6176,このゴミは何? 最期の嫌がらせね,ゴミ捨て場よ,disgust
6177,ゴミ捨て場よ,それじゃゴミ捨て場に失礼だ,anger
6178,それじゃゴミ捨て場に失礼だ,こりゃいい ちょうだい,neutral
6179,職場で今日も切ったり焼いたりしてたら一,急に店長に呼ばれたの,neutral
6180,急に店長に呼ばれたの,ランチの料理長にって,joy
6181,ランチの料理長にって,見る目ないな,sadness
6182,見る目ないな,一応昇進よ,joy
6183,一応昇進よ,仕入れの責任者も兼任なの,joy
6184,仕入れの責任者も兼任なの,兄貴が今夜お祝いだっておしゃれな店で,joy
6185,兄貴が今夜お祝いだっておしゃれな店で,腎臓売ろうかな,neutral
6186,感想は?,美しいテーブルだ,joy
6187,美しいテーブルだ,人形の頭にお皿載せるの?,neutral
6188,人形の頭にお皿載せるの?,食事はシンクでする,joy
6189,食事はシンクでする,いくわ 入った! 下手クソ,joy
6190,楽にしててね,了解,neutral
6191,了解,元は祖母の部屋よ,neutral
6192,元は祖母の部屋よ,フロリダに越して代わりに私が,neutral
6193,フロリダに越して代わりに私が,この話は大家さんには内緒なのよ. まだ暑い?,neutral
6194,この話は大家さんには内緒なのよ. まだ暑い?,ホットだぜ,joy
6195,ホットだぜ,お待たせ ペニス?,surprise
6196,驚きのプランってここのことね,元は母の別荘だ ここがキッチン,neutral
6197,さあ食事へ,行きましょ,joy
6198,行きましょ,あの店大好き,neutral
6199,あの店大好き,じゃモマレゼッティは?,neutral
6200,じゃモマレゼッティは?,最低いいわ,neutral
6201,最低いいわ,牛乳を出したままだ,disgust
6202,牛乳を出したままだ,いいのこの店は衛生的よ,neutral
6203,いいのこの店は衛生的よ,これは私の牛乳なの飲みたくて買ったのよ,neutral
6204,これは私の牛乳なの飲みたくて買ったのよ,行こう,joy
6205,行こう,ちょっと 第11項のBにゴミは裏口から捨てるとあるぞ,anger
6206,ちょっと 第11項のBにゴミは裏口から捨てるとあるぞ,でも遠回りなんです,neutral
6207,でも遠回りなんです,衛生より楽を取る気?,disgust
6208,衛生より楽を取る気?,やめて,anger
6209,やめて,衛生検査官のラリーより普通のラリーになって,neutral
6210,衛生検査官のラリーより普通のラリーになって,最初は楽しかったけどじゃどこで食うのって感じ,anger
6211,最初は楽しかったけどじゃどこで食うのって感じ,今回は注意にとどめる,neutral
6212,今回は注意にとどめる,よければあとで鼻をほじるホットドッグ屋を紹介するわ,disgust
6213,ここがいい わ紙 タオル投げもできる,流し台でクッキーもオツよ,joy
6214,流し台でクッキーもオツよ,悪いけど交換はイヤ,sadness
6215,悪いけど交換はイヤ,分かった,neutral
6216,分かった,楽しそうね,neutral
6217,楽しそうね,うらやましい,neutral
6218,成績は? ロス隊員,負けた,sadness
6219,負けた,1位の子は19歳の姉が隊員姿で一,sadness
6220,1位の子は19歳の姉が隊員姿で一,海軍船に訪問して200箱以上売った,anger
6221,海軍船に訪問して200箱以上売った,面接は?,joy
6222,面接は?,自分が面接官でも落とす,sadness
6223,自分が面接官でも落とす,元気出して あと100回は面接を受けるんだから,sadness
6224,元気出して あと100回は面接を受けるんだから,励まし間違いだ,sadness
6225,励まし間違いだ,レイチェルならこの店に残ったら?,neutral
6226,レイチェルならこの店に残ったら?,手遅れよ,anger
6227,手遅れよ,もう新人が入ったの,sadness
6228,もう新人が入ったの,しかもウェートレスの経験者よ,sadness
6229,しかもウェートレスの経験者よ,彼女はみんなにナプキンの折り方も教えてた 出来上がりは,sadness
6230,彼女はみんなにナプキンの折り方も教えてた 出来上がりは,白鳥だって,neutral
6231,中身は?,男物のパンツの燃え残り カードに一 半分こげた写真だ 隊長より毛深い,surprise
6232,男物のパンツの燃え残り カードに一 半分こげた写真だ 隊長より毛深い,ボヤの原因は笑える話よ,joy
6233,ボヤの原因は笑える話よ,説明は必要ない,neutral
6234,説明は必要ない,彼氏の思い出を清算だろ,neutral
6235,彼氏の思い出を清算だろ,今夜3件目だ ホント?,neutral
6236,今夜3件目だ ホント?,バレンタインボヤだ,neutral
6237,ごめんね 私のせいで盛り下がって,レイチェルは正しいわ見通しゼロよ,neutral
6238,レイチェルは正しいわ見通しゼロよ,やった,joy
6239,やった,人生設計は?,neutral
6240,人生設計は?,モニカ人生ある?,joy
6241,モニカ人生ある?,何笑 つ て 私たちの注文と違うわ チーズ多めのダイエットピザよ,sadness
6242,何笑 つ て 私たちの注文と違うわ チーズ多めのダイエットピザよ,待ってステファノポロスって? 向かいのビルと間違えたこのバカタレ,surprise
6243,待ってステファノポロスって? 向かいのビルと間違えたこのバカタレ,それって小柄なヨーロッパ系で知的な人?,surprise
6244,それって小柄なヨーロッパ系で知的な人?,青のスーツが似合いの?,joy
6245,青のスーツが似合いの?,ピンク系のネクタイ?,joy
6246,ピンク系のネクタイ?,ステファノポロスのピザでいいわよ!,surprise
6247,ステファノポロスのピザでいいわよ!,スナファラパガスって誰?,neutral
6248,スナファラパガスって誰?,セサミのスナッフィー,neutral
6249,セサミのスナッフィー,ピザが見える!,joy
6250,ピザが見える!,私にも見せて,joy
6251,私にも見せて,ねえ誰なのよ,sadness
6252,雨の日の遊びといえば?,ストリップポーカーだ,joy
6253,ストリップポーカーだ,やめて,disgust
6254,やめて,旅行に娯楽は付きもの これは法律だ,sadness
6255,旅行に娯楽は付きもの これは法律だ,できた,neutral
6256,できた,次は誰?,neutral
6257,次は誰?,よせよ,disgust
6258,よせよ,塗らせて退屈よ 前に塗ったわ,neutral
6259,塗らせて退屈よ 前に塗ったわ,塗らなきゃならない法が?,joy
6260,きれいだわ生まれ変わったみたい 入る気?,整理券いる?,neutral
6261,整理券いる?,すぐ戻るわ それとも一緒に来る?,neutral
6262,すぐ戻るわ それとも一緒に来る?,決定したよ ファイナルリストだ,neutral
6263,決定したよ ファイナルリストだ,お疲れさま 本格的だ,neutral
6264,お疲れさま 本格的だ,チャンドラーが印刷した,neutral
6265,チャンドラーが印刷した,パウチは?,neutral
6266,パウチは?,僕がした,neutral
6267,僕がした,見せて ユマサーマンウィノナライダー エリザベスハーリーミシェルファイファー,neutral
6268,見せて ユマサーマンウィノナライダー エリザベスハーリーミシェルファイファー,僕の好みだ,anger
6269,僕の好みだ,ベッドであのスピンは無理よ,neutral
6270,お待たせドクターオーバーマンだ 彼はフォンジーにもハッピーデイズにも無関心,ボクちゃん何年生?,surprise
6271,ボクちゃん何年生?,私もよ ロス 大人の医者を呼んでちょうだい,joy
6272,私もよ ロス 大人の医者を呼んでちょうだい,お産なら僕だって,joy
6273,お産なら僕だって,シッシッ,anger
6274,シッシッ,分からないの? じき子供が出てくるのよ,surprise
6275,分からないの? じき子供が出てくるのよ,行ってガキんちょ,anger
6276,行ってガキんちょ,やった 泣いたぞ,joy
6277,外に人が集まってるよアメくれとかって,待たせてるの手いっぱいよ,anger
6278,待たせてるの手いっぱいよ,手伝おう,neutral
6279,手伝おう,システムが崩れるわ,anger
6280,免許証を,夢の話は聞かないわけ? お名前はプリティー?,neutral
6281,夢の話は聞かないわけ? お名前はプリティー?,ペティーだ チケットをやる,neutral
6282,ペティーだ チケットをやる,あなた子持ちょ 分かってる,surprise
6283,この酒パンチが足りない,どうも ビング主任,neutral
6284,どうも ビング主任,カラオケ最高でした,joy
6285,カラオケ最高でした,今週の数字を出してくれ9時までだ,neutral
6286,今週の数字を出してくれ9時までだ,すぐに,neutral
6287,すぐに,絞ってやるぞ,joy
6288,絞ってやるぞ,今のはガーストンにサントスヒゲは?,neutral
6289,今のはガーストンにサントスヒゲは?,ピートリー,neutral
6290,ピートリー,じゃ連中には一 仕事させよう,neutral
6291,全員に捨てられた,君たちだけが友達だ君とスーザンがね」,anger
6292,君たちだけが友達だ君とスーザンがね」,スーザンの分は?,surprise
6293,スーザンの分は?,ないからピクルスでも出す,neutral
6294,ないからピクルスでも出す,助かった フィービー?,joy
6295,助かった フィービー?,なぜ小声?,surprise
6296,なぜ小声?,食べたの,disgust
6297,食べたの,タンポンが安いの買いだめしよう,joy
6298,タンポンが安いの買いだめしよう,ガス欠で今いる場所も分からないの,fear
6299,ガス欠で今いる場所も分からないの,僕に助けろと?,joy
6300,僕に助けろと?,お願い,neutral
6301,お願い,本物の友達と遊んでるんだ 無事に帰ったら教えて,anger
6302,本物の友達と遊んでるんだ 無事に帰ったら教えて,待ってて 車を貸すわ,neutral
6303,待ってて 車を貸すわ,行かない,anger
6304,行かない,あなたは意地悪する人じゃない,neutral
6305,あなたは意地悪する人じゃない,レイチェルが,anger
6306,レイチェルが,マークって人と浮気した彼女は全面的に悪いけど ほかの人を助けて,neutral
6307,マークって人と浮気した彼女は全面的に悪いけど ほかの人を助けて,そうだね,neutral
6308,兄さんに悪かった,ホントね,sadness
6309,ホントね,俺のせいみたい,sadness
6310,俺のせいみたい,みたい お前がしゃべったせいだ,anger
6311,みたい お前がしゃべったせいだ,最近言えないことが多くてパンク寸前でね,anger
6312,最近言えないことが多くてパンク寸前でね,よく言ってくれた,anger
6313,よく言ってくれた,つらいから散歩してくる,neutral
6314,つらいから散歩してくる,動物の権利はどうした?,anger
6315,動物の権利はどうした?,本で勉強したのミンクは悪い動物よ,anger
6316,本で勉強したのミンクは悪い動物よ,フィルハントリーに抱かれるよりいい気分なの,joy
6317,フィルハントリーに抱かれるよりいい気分なの,フィルはいい男だった,neutral
6318,外すわ,ごめんね パパには明日会って誤解を解くわ またはEメールで,sadness
6319,ごめんね パパには明日会って誤解を解くわ またはEメールで,居合わせてショックを受けた,anger
6320,居合わせてショックを受けた,彼女のEメールアドレスを,neutral
6321,彼女のEメールアドレスを,私がちゃんと取りなすわ,fear
6322,私がちゃんと取りなすわ,終わり?,anger
6323,終わり?,やってよ,anger
6324,やってよ,別れたあとだあとじゃないって,surprise
6325,ブリトーを持ち帰りで,毎日聞かされる私の身になって,neutral
6326,毎日聞かされる私の身になって,ビングで予約したわ,neutral
6327,ビングで予約したわ,ご案内まで45分かかります,neutral
6328,ご案内まで45分かかります,8時には観劇の予定だ,surprise
6329,8時には観劇の予定だ,この時期は込みますので,neutral
6330,この時期は込みますので,俺の冗談に仕返し?,sadness
6331,俺の冗談に仕返し?,お金を渡して,neutral
6332,お金を渡して,ただの冗談だぞ,surprise
6333,ただの冗談だぞ,先に入れてもらうの金がモノを言うわ,anger
6334,先に入れてもらうの金がモノを言うわ,青スジ立てるな,neutral
6335,青スジ立てるな,渡すから さりげなくね,neutral
6336,渡すから さりげなくね,俺を見損なうなよ,neutral
6337,俺を見損なうなよ,急いでるんで早く入れてくれたまえ,neutral
6338,急いでるんで早く入れてくれたまえ,分かりました,neutral
6339,じゃ戻ります,査定をアップするわ,joy
6340,査定をアップするわ,何を?,surprise
6341,何を?,入社2か月でしょ 私が仕事ぶりを評価するの,neutral
6342,入社2か月でしょ 私が仕事ぶりを評価するの,でもまだ1つ試してないことが,neutral
6343,でもまだ1つ試してないことが,手伝って,neutral
6344,ブローしてジェルもつけたがハネる,これ変? お前が変,sadness
6345,これ変? お前が変,お前は間が悪すぎ,neutral
6346,何してるの?,掃除だ 興奮してきた?,neutral
6347,掃除だ 興奮してきた?,煙突掃除なら?,joy
6348,煙突掃除なら?,クリームでも食べた?,neutral
6349,クリームでも食べた?,司祭は留守だよ,joy
6350,司祭は留守だよ,司祭って何か分かってるの?,surprise
6351,司祭って何か分かってるの?,分かってるさ,neutral
6352,分かってるさ,本を見たの? 見たとも,anger
6353,本を見たの? 見たとも,昼寝しに入ったのは謝るでもエロ本があった,surprise
6354,昼寝しに入ったのは謝るでもエロ本があった,本のことは別に恥じないわ,anger
6355,本のことは別に恥じないわ,女も楽しんでいいはずよエロスぐらい,neutral
6356,女も楽しんでいいはずよエロスぐらい,性を表現した健全な芸術だもの あなたには理解不能よね,anger
6357,性を表現した健全な芸術だもの あなたには理解不能よね,エロ本じゃん,joy
6358,小腹減った,スコットランドのお菓子はどう?」,neutral
6359,スコットランドのお菓子はどう?」,いらないスコットランド系の物は嫌いだ,neutral
6360,いらないスコットランド系の物は嫌いだ,うちの一族はあの地を追われた バイキングに,sadness
6361,うちの一族はあの地を追われた バイキングに,でも一族のルーツを再発見してみたら?,neutral
6362,でも一族のルーツを再発見してみたら?,バグパイプはやめて!,anger
6363,バグパイプはやめて!,なぜ知ってる?,surprise
6364,また来てくれたね,応募殺到だったが君を最後の候補に絞った,neutral
6365,応募殺到だったが君を最後の候補に絞った,決定前に俺たちの相性を確かめたい,neutral
6366,決定前に俺たちの相性を確かめたい,テストするよ,neutral
6367,テストするよ,キーワードから連想する言葉を,neutral
6368,キーワードから連想する言葉を,分かった,neutral
6369,分かった,枕投D,neutral
6370,枕投D,いいねえ,joy
6371,いいねえ,ワンワンする,joy
6372,ワンワンする,猫ちゃん,neutral
6373,猫ちゃん,相性が悪いバイバイ,sadness
6374,父さん歯はほじらないで,足を乗せるのも,disgust
6375,足を乗せるのも,好きにさせて!,anger
6376,好きにさせて!,急いでよ,sadness
6377,急いでよ,言わなかった?,surprise
6378,言わなかった?,ジャニーンの友達はダンサーで酔っ払ってる,anger
